CURP,Nombre,TipoLegislacion,Partido,FechaNacimiento,LugarNacimiento,PrincipioEleccion,Zona,UltimoGradoEstudios,PreparacionAcademica,Legislatura,InicioLegislatura,FinLegislatura
pedropablotreviñovillarreal,Pedro Pablo Treviño Villarreal,Diputado Propietario,PRI,1972-06-13, Nuevo León ,Mayoría Relativa, Nuevo León Distrito: 12 (Cadereyta Jiménez) ,Maestría,Derecho,LXII,2012-08-29,2015-08-31
pedroporrasperez,Pedro Porras Pérez,Diputado Propietario,PRD,1959-08-01, Hidalgo ,Representación Proporcional, México Circunscripción: Quinta ,Profesor Normalista,,LXII,2012-08-29,2015-08-31
petrabarrerabarrera,Petra Barrera Barrera,Diputada Propietario,PRI,1961-04-29, Guanajuato ,Mayoría Relativa, Guanajuato Distrito: 1 (San Luis de la Paz) ,Secundaria,,LXII,2012-08-29,2015-08-31
purificacioncarpinteyrocalderon,Purificación Carpinteyro Calderón,Diputada Propietario,PRD,1961-05-01, Distrito Federal ,Mayoría Relativa, Distrito Federal Distrito: 22 (Iztapalapa) ,Maestría,Derecho,LXII,2012-08-29,2015-08-31
rabindranathsalazarsolorio,Rabindranath Salazar Solorio,Senador Propietario,PRD,1968-06-02, Morelos ,Mayoría Relativa, Morelos ,Licenciatura,Administración y contaduría,LXII,2012-08-29,2015-08-31
rafaelacostacroda,Rafael Acosta Croda,Diputado Propietario,PAN,1957-05-27, Veracruz ,Mayoría Relativa, Veracruz Distrito: 12 (Veracruz) ,Maestría,Ingeniería,LXII,2012-08-29,2015-08-31
rafaelalejandromicalcomendez,Rafael Alejandro Micalco Méndez,Diputado Propietario,PAN,1970-01-21, San Luis Potosí ,Representación Proporcional, Puebla Circunscripción: Cuarta ,Licenciatura,Administración y contaduría,LXII,2012-08-29,2015-08-31
rafaelgonzalezresendiz,Rafael González Reséndiz,Diputado Propietario,PRI,1979-03-26, Jalisco ,Mayoría Relativa, Jalisco Distrito: 5 (Puerto Vallarta) ,Maestría,Otra,LXII,2012-08-29,2015-08-31
rafaelreyesmontemayor,Rafael Reyes Montemayor,Diputado Suplente,PRI,1900-01-01, ,Mayoría Relativa, Nuevo León Distrito: 11 (Guadalupe) ,,,LXII,2012-08-29,2015-08-31
ramonantoniosampayoortiz,Ramón Antonio Sampayo Ortiz,Diputado Propietario,PAN,1957-08-31, Tamaulipas ,Representación Proporcional, Tamaulipas Circunscripción: Segunda ,Licenciatura,Administración y contaduría,LXII,2012-08-29,2015-08-31
ramonmontalvohernandez,Ramón Montalvo Hernández,Diputado Propietario,PRD,1974-07-29, México ,Representación Proporcional, México Circunscripción: Quinta ,Licenciatura,Arquitectura y diseño,LXII,2012-08-29,2015-08-31
raqueljimenezcerrillo,Raquel Jiménez  Cerrillo,Diputada Propietario,PAN,1966-01-21, Guanajuato ,Representación Proporcional, Querétaro Circunscripción: Segunda ,Maestría,Administración y contaduría,LXII,2012-08-29,2015-08-31
raudellopezlopez,Raudel López López,Diputado Propietario,PAN,1969-12-17, Aguascalientes ,Representación Proporcional, Aguascalientes Circunscripción: Segunda ,Preparatoria,,LXII,2012-08-29,2015-08-31
raymundokingdelarosa,Raymundo King de la Rosa,Diputado Propietario,PRI,1976-12-18, Quintana Roo ,Mayoría Relativa, Quintana Roo Distrito: 2 (Chetumal) ,Licenciatura,Derecho,LXII,2012-08-29,2015-08-31
raulaaronpozoslanz,Raúl Aarón Pozos Lanz,Senador Propietario,PRI,1967-06-30, ,Mayoría Relativa, Campeche ,Maestría,Ciencias políticas y sociales,LXII,2012-08-29,2015-08-31
raulgraciaguzman,Raúl Gracia Guzmán,Senador Propietario,PAN,1975-02-20, Nuevo León ,Primera Minoría, Nuevo León ,Licenciatura,Derecho,LXII,2012-08-29,2015-08-31
raulmaciassandoval,Raúl Macías Sandoval,Diputado Propietario,PRI,1942-09-22, ,Representación Proporcional, México Circunscripción: Quinta ,Maestría,Otra,LXII,2012-08-29,2015-08-31
raulmoronorozco,Raúl Morón Orozco,Senador Propietario,PRD,1958-10-25, Michoacán ,Primera Minoría, Michoacán ,Licenciatura,Ciencias de la educación,LXII,2012-08-29,2015-08-31
raulpazalonzo,Raúl Paz Alonzo,Diputado Propietario,PAN,1976-02-21, Yucatán ,Mayoría Relativa, Yucatán Distrito: 4 (Mérida) ,Licenciatura,Económico-financiera,LXII,2012-08-29,2015-08-31
raulsantosgalvanvillanueva,Raúl Santos Galván Villanueva,Diputado Propietario,PRI,1944-12-01, Nuevo León ,Representación Proporcional, Sinaloa Circunscripción: Primera ,Maestría,Otra,LXII,2012-08-29,2015-08-31
reginavazquezsaut,Regina Vázquez Saut,Diputada Propietario,PRI,1981-09-11, Veracruz ,Mayoría Relativa, Veracruz Distrito: 20 (Acayucan) ,Licenciatura,Económico-financiera,LXII,2012-08-29,2015-08-31
renejuarezcisneros,René Juárez Cisneros,Senador Propietario,PRI,1956-06-08, Guerrero ,Primera Minoría, Guerrero ,Licenciatura,Económico-financiera,LXII,2012-08-29,2015-08-31
renericardofujiwaramontelongo,René Ricardo Fujiwara Montelongo,Diputado Propietario,Panal,1984-04-07, Distrito Federal ,Representación Proporcional, Distrito Federal Circunscripción: Cuarta ,Licenciatura,Humanidades,LXII,2012-08-29,2015-08-31
ricardoastudillosuarez,Ricardo Astudillo Suárez,Diputado Propietario,PVEM,1975-06-26, Distrito Federal ,Mayoría Relativa, Querétaro Distrito: 2 (San Juan del Río) ,Licenciatura,Arquitectura y diseño,LXII,2012-08-29,2015-08-31
ricardobarrosoagramont,Ricardo Barroso Agramont,Senador Propietario,PRI,1980-02-29, Baja California Sur ,Mayoría Relativa, Baja California Sur ,Licenciatura,Derecho,LXII,2012-08-29,2015-08-31
ricardocantugarza,Ricardo Cantú Garza,Diputado Propietario,PT,1953-05-23, Nuevo León ,Representación Proporcional, México Circunscripción: Quinta ,Maestría,Ciencias políticas y sociales,LXII,2012-08-29,2015-08-31
ricardofidelpachecorodriguez,Ricardo Fidel Pacheco Rodríguez,Diputado Propietario,PRI,1963-09-18, Durango ,Representación Proporcional, Durango Circunscripción: Primera ,Licenciatura,Derecho,LXII,2012-08-29,2015-08-31
ricardofloressuarez,Ricardo Flores Suárez,Diputado Suplente,PAN,1900-01-01, ,Mayoría Relativa, Nuevo León Distrito: 4 (San Nicolás de los Garza) ,Licenciatura,Derecho,LXII,2012-08-29,2015-08-31
ricardomedinafierro,Ricardo Medina Fierro,Diputado Suplente,PRI,1975-08-05, Baja California ,Mayoría Relativa, Baja California Distrito: 3 (Ensenada) ,Maestría,Económico-financiera,LXII,2012-08-29,2015-08-31
ricardourzuarivera,Ricardo Urzúa Rivera,Senador Suplente,PRI,1966-05-19, Distrito Federal ,Representación Proporcional, N/A ,Licenciatura,Ingeniería,LXII,2012-08-29,2015-08-31
ricardovillarrealgarcia,Ricardo Villarreal  García,Diputado Propietario,PAN,1981-04-12, Guanajuato ,Mayoría Relativa, Guanajuato Distrito: 2 (San Miguel de Allende) ,Licenciatura,Derecho,LXII,2012-08-29,2015-08-31
robertoarmandoalboresgleason,Roberto Armando Albores Gleason,Senador Propietario,PRI,1979-02-16, Chiapas ,Mayoría Relativa, Chiapas ,Licenciatura,Económico-financiera,LXII,2012-08-29,2015-08-31
robertocarlosreyesgamiz,Roberto Carlos Reyes Gámiz,Diputado Propietario,PRD,1969-09-25, Distrito Federal ,Mayoría Relativa, Distrito Federal Distrito: 13 (Iztacalco) ,Licenciatura,Económico-financiera,LXII,2012-08-29,2015-08-31
robertogilzuarth,Roberto Gil Zuarth,Senador Propietario,PAN,1977-10-10, Chiapas ,Representación Proporcional, N/A ,Doctorado,Derecho,LXII,2012-08-29,2015-08-31
robertolopezgonzalez,Roberto López González,Diputado Propietario,PRD,1958-06-07, Jalisco ,Representación Proporcional, Jalisco Circunscripción: Primera ,Maestría,Ciencias políticas y sociales,LXII,2012-08-29,2015-08-31
robertolopezrosado,Roberto López Rosado,Diputado Suplente,PRD,1961-02-16, Oaxaca ,Representación Proporcional, Oaxaca Circunscripción: Tercera ,Licenciatura,Administración y contaduría,LXII,2012-08-29,2015-08-31
robertolopezsuarez,Roberto López Suárez,Diputado Propietario,PRD,1972-09-09, Distrito Federal ,Representación Proporcional, Zacatecas Circunscripción: Segunda ,Pasante/Licenciatura trunca,Ciencias políticas y sociales,LXII,2012-08-29,2015-08-31
robertoruizmoronatti,Roberto Ruíz Moronatti,Diputado Propietario,PRI,1982-01-01, México ,Mayoría Relativa, México Distrito: 6 (Coacalco de Berriozabal) ,Licenciatura,Administración y contaduría,LXII,2012-08-29,2015-08-31
rocioesmeraldarezagallegos,Rocío Esmeralda Reza Gallegos,Diputada Propietario,PAN,1968-04-19, Chihuahua ,Representación Proporcional, Chihuahua Circunscripción: Primera ,Licenciatura,Ingeniería,LXII,2012-08-29,2015-08-31
rociosantosdelacruz,Rocío Santos de la Cruz,Diputada Suplente,PRI,1900-01-01, ,Representación Proporcional, México Circunscripción: Quinta ,Licenciatura,Administración y contaduría,LXII,2012-08-29,2015-08-31
rodimirobarreraestrada,Rodimiro Barrera Estrada,Diputado Propietario,PRI,1968-03-20, Michoacán ,Mayoría Relativa, Michoacán Distrito: 1 (Lázaro Cárdenas) ,Licenciatura,Económico-financiera,LXII,2012-08-29,2015-08-31
rodolfodoradorperezgavilan,Rodolfo Dorador Pérez Gavilán,Diputado Propietario,PAN,1969-02-13, Durango ,Representación Proporcional, Durango Circunscripción: Primera ,Maestría,Derecho,LXII,2012-08-29,2015-08-31
rodrigochavezcontreras,Rodrigo Chávez Contreras,Diputado Suplente,Morena,1960-01-01, Distrito Federal ,Representación Proporcional, Distrito Federal Circunscripción: Cuarta ,Licenciatura,Ciencias políticas y sociales,LXII,2012-08-29,2015-08-31
romanalfredopadillafierro,Román Alfredo Padilla Fierro,Diputado Propietario,PRI,1949-01-12, Sinaloa ,Mayoría Relativa, Sinaloa Distrito: 1 (El Fuerte) ,Técnico,Comunicación,LXII,2012-08-29,2015-08-31
rosaadrianadiazlizama,Rosa Adriana Díaz Lizama,Senadora Propietario,PAN,1973-11-16, Yucatán ,Mayoría Relativa, Yucatán ,Maestría,Administración y contaduría,LXII,2012-08-29,2015-08-31
rosaelbaperezhernandez,Rosa Elba Pérez Hernández,Diputada Propietario,PVEM,1968-09-30, Guanajuato ,Mayoría Relativa, Guanajuato Distrito: 6 (León) ,Maestría,Ciencias políticas y sociales,LXII,2012-08-29,2015-08-31
rosaeliaromeroguzman,Rosa Elia Romero Guzmán,Diputada Propietario,PT,1973-05-14, Oaxaca ,Mayoría Relativa, Oaxaca Distrito: 6 (Heroica Ciudad de Tlaxiaco) ,Técnico,,LXII,2012-08-29,2015-08-31
rosalbadelacruzrequena,Rosalba De la Cruz Requena,Diputada Propietario,PRI,1954-04-04, ,Mayoría Relativa, Tamaulipas Distrito: 6 (El Mante) ,Licenciatura,Otra,LXII,2012-08-29,2015-08-31
rosalbagualitocastañeda,Rosalba Gualito Castañeda,Diputada Propietario,PRI,1966-09-19, ,Mayoría Relativa, México Distrito: 22 (Naucalpan de Juárez) ,Licenciatura,Otra,LXII,2012-08-29,2015-08-31
rosendoserranotoledo,Rosendo Serrano  Toledo,Diputado Propietario,PRD,1959-05-20, Oaxaca ,Representación Proporcional, Oaxaca Circunscripción: Tercera ,,,LXII,2012-08-29,2015-08-31
roxanalunaporquillo,Roxana Luna Porquillo,Diputada Propietario,PRD,1981-03-24, Puebla ,Representación Proporcional, Puebla Circunscripción: Cuarta ,Maestría,Derecho,LXII,2012-08-29,2015-08-31
royargelgomezolguin,Roy Argel Gómez Olguín,Diputado Propietario,PRI,1973-10-24, Nayarit ,Mayoría Relativa, Nayarit Distrito: 2 (Tepic) ,Licenciatura,Otra,LXII,2012-08-29,2015-08-31
rubenacostamontoya,Rubén Acosta Montoya,Diputado Propietario,PVEM,1973-12-02, Chihuahua ,Representación Proporcional, Chihuahua Circunscripción: Primera ,Licenciatura,Derecho,LXII,2012-08-29,2015-08-31
rubenbenjaminfelixhays,Rubén Benjamín Félix Hays,Diputado Propietario,Panal,1964-03-15, Sinaloa ,Representación Proporcional, Sinaloa Circunscripción: Primera ,Licenciatura,Administración y contaduría,LXII,2012-08-29,2015-08-31
rubencamarilloortega,Rubén Camarillo Ortega,Diputado Propietario,PAN,1961-11-13, Aguascalientes ,Representación Proporcional, Aguascalientes Circunscripción: Segunda ,Maestría,Ciencias,LXII,2012-08-29,2015-08-31
ruthzavaletasalgado,Ruth Zavaleta Salgado,Diputada Propietario,PVEM,1966-08-27, Guerrero ,Representación Proporcional, Distrito Federal Circunscripción: Cuarta ,Maestría,Derecho,LXII,2012-08-29,2015-08-31
salomonjuanmarcosissa,Salomón Juan Marcos Issa,Diputado Propietario,PRI,1948-07-05, Coahuila ,Mayoría Relativa, Coahuila Distrito: 5 (Torreón) ,Licenciatura,Administración y contaduría,LXII,2012-08-29,2015-08-31
salvadorarellanoguzman,Salvador Arellano Guzmán,Diputado Propietario,PRI,1957-08-30, Jalisco ,Mayoría Relativa, Jalisco Distrito: 4 (Zapopan) ,Licenciatura,Ingeniería,LXII,2012-08-29,2015-08-31
salvadorbarajasdeltoro,Salvador Barajas Del Toro,Diputado Propietario,PRI,1972-05-08, Jalisco ,Mayoría Relativa, Jalisco Distrito: 19 (Ciudad Guzmán) ,Preparatoria,,LXII,2012-08-29,2015-08-31
salvadorortizgarcia,Salvador Ortiz García,Diputado Propietario,PRI,1964-11-28, Michoacán ,Mayoría Relativa, Michoacán Distrito: 12 (Apatzingán de la Constitución) ,Licenciatura,Agropecuaria y zootecnia,LXII,2012-08-29,2015-08-31
salvadorromerovalencia,Salvador Romero Valencia,Diputado Propietario,PRI,1960-10-30, Michoacán ,Mayoría Relativa, Michoacán Distrito: 4 (Jiquilpan de Juárez) ,Licenciatura,Ingeniería,LXII,2012-08-29,2015-08-31
salvadorvegacasillas,Salvador Vega Casillas,Senador Propietario,PAN,1961-08-18, Michoacán ,Representación Proporcional, N/A ,Maestría,Administración y contaduría,LXII,2012-08-29,2015-08-31
samuelgurrionmatias,Samuel Gurrión Matías,Diputado Propietario,PRI,1968-01-03, Oaxaca ,Mayoría Relativa, Oaxaca Distrito: 7 (Juchitán de Zaragoza) ,Licenciatura,Derecho,LXII,2012-08-29,2015-08-31
sergioaugustochanlugo,Sergio Augusto Chan  Lugo,Diputado Propietario,PAN,1967-08-16, Yucatán ,Representación Proporcional, Yucatán Circunscripción: Tercera ,Licenciatura,Derecho,LXII,2012-08-29,2015-08-31
shantallzepedaescobar,Shantall Zepeda Escobar,Diputada Suplente,PRI,1900-01-01, ,Mayoría Relativa, México Distrito: 26 (Toluca de Lerdo) ,Maestría,Administración y contaduría,LXII,2012-08-29,2015-08-31
silvanaortizortega,Silvana Ortiz Ortega,Diputada Suplente,PRI,1900-01-01, ,Mayoría Relativa, México Distrito: 18 (Huixquilucan de Degollado) ,Maestría,Otra,LXII,2012-08-29,2015-08-31
silviaguadalupegarzagalvan,Silvia Guadalupe Garza Galván,Senadora Propietario,PAN,1962-07-05, Coahuila ,Mayoría Relativa, Coahuila ,Licenciatura,Ciencias,LXII,2012-08-29,2015-08-31
silviamarquezvelasco,Silvia Márquez Velasco,Diputada Propietario,PRI,1961-08-23, Distrito Federal ,Mayoría Relativa, México Distrito: 14 (Ciudad Adolfo López Mateos) ,Licenciatura,Económico-financiera,LXII,2012-08-29,2015-08-31
simonlomelicervantes,Simón Lomelí Cervantes,Diputado Suplente,PAN,1900-01-01, ,Mayoría Relativa, Nuevo León Distrito: 8 (Guadalupe) ,Licenciatura,Administración y contaduría,LXII,2012-08-29,2015-08-31
simonvalancibuzali,Simón Valanci Buzali,Diputado Propietario,PRI,1962-01-05, Chiapas ,Representación Proporcional, Chiapas Circunscripción: Tercera ,Maestría,Ciencias políticas y sociales,LXII,2012-08-29,2015-08-31
socorrosofioramirezhernandez,Socorro Sofío Ramírez Hernández,Senador Propietario,PRD,1967-06-27, Guerrero ,Mayoría Relativa, Guerrero ,Licenciatura,Derecho,LXII,2012-08-29,2015-08-31
socorrodelaluzquintanaleon,Socorro de la Luz Quintana León,Diputada Propietario,PRI,1962-12-23, Michoacán ,Mayoría Relativa, Michoacán Distrito: 9 (Uruapan del Progreso) ,Maestría,Administración y contaduría,LXII,2012-08-29,2015-08-31
soniacatalinamercadogallegos,Sonia Catalina Mercado Gallegos,Diputada Propietario,PRI,1968-10-23, Durango ,Mayoría Relativa, Durango Distrito: 1 (Victoria de Durango) ,Licenciatura,Administración y contaduría,LXII,2012-08-29,2015-08-31
soniarinconchanona,Sonia Rincón Chanona,Diputada Propietario,Panal,1952-11-10, Chiapas ,Representación Proporcional, Chiapas Circunscripción: Tercera ,Licenciatura,Ciencias de la educación,LXII,2012-08-29,2015-08-31
soniarochaacosta,Sonia Rocha Acosta,Senadora Suplente,PAN,1978-03-30, Querétaro ,Mayoría Relativa, Querétaro ,Licenciatura,Derecho,LXII,2012-08-29,2015-08-31
taniamargaritamorgannavarrete,Tania Margarita Morgan  Navarrete,Diputada Propietario,PAN,1985-08-12, Distrito Federal ,Representación Proporcional, Sinaloa Circunscripción: Primera ,Licenciatura,Ciencias políticas y sociales,LXII,2012-08-29,2015-08-31
teresadejesusmojicamorga,Teresa de Jesús Mojica Morga,Diputada Propietario,PRD,1970-10-03, Guerrero ,Representación Proporcional, Guerrero Circunscripción: Cuarta ,Licenciatura,Comunicación,LXII,2012-08-29,2015-08-31
teresitadejesusborgespasos,Teresita de Jesús Borges Pasos,Diputada Propietario,PRD,1965-08-17, Yucatán ,Representación Proporcional, Yucatán Circunscripción: Tercera ,Profesor Normalista,Ciencias de la educación,LXII,2012-08-29,2015-08-31
teresitadejesusramirezhernandez,Teresita de Jesús Ramírez Hernández,Diputada Suplente,PRI,1900-01-01, ,Mayoría Relativa, México Distrito: 37 (Cuautitlán) ,Técnico,Ciencias de la salud,LXII,2012-08-29,2015-08-31
teofilotorrescorzo,Teófilo Torres Corzo,Senador Propietario,PRI,1946-08-09, San Luis Potosí ,Primera Minoría, San Luis Potosí ,Maestría,Administración y contaduría,LXII,2012-08-29,2015-08-31
tomasbritolara,Tomás Brito Lara,Diputado Propietario,PRD,1958-01-11, Tabasco ,Mayoría Relativa, Tabasco Distrito: 2 (Heroica Cárdenas) ,Técnico,Otra,LXII,2012-08-29,2015-08-31
tomaslopezlandero,Tomás López Landero,Diputado Propietario,PRI,1950-03-14, Tabasco ,Mayoría Relativa, Veracruz Distrito: 18 (Zongolica) ,Técnico,Administración y contaduría,LXII,2012-08-29,2015-08-31
tomastorresmercado,Tomás Torres Mercado,Diputado Propietario,PVEM,1960-12-15, Zacatecas ,Representación Proporcional, Zacatecas Circunscripción: Segunda ,Maestría,Derecho,LXII,2012-08-29,2015-08-31
trinidadsecundinomoralesvargas,Trinidad Secundino Morales Vargas,Diputado Propietario,PRD,1957-06-16, Chihuahua ,Representación Proporcional, Distrito Federal Circunscripción: Cuarta ,,,LXII,2012-08-29,2015-08-31
ulisesivanvalenciaperez,Ulises Iván Valencia Pérez,Diputado Suplente,PRD,1900-01-01, ,Representación Proporcional, Michoacán Circunscripción: Quinta ,,,LXII,2012-08-29,2015-08-31
urielfloresaguayo,Uriel Flores Aguayo,Diputado Propietario,PRD,1959-05-06, Veracruz ,Mayoría Relativa, Veracruz Distrito: 10 (Xalapa) ,Licenciatura,Derecho,LXII,2012-08-29,2015-08-31
valentingonzalezbautista,Valentín González Bautista,Diputado Propietario,PRD,1955-11-03, Oaxaca ,Mayoría Relativa, México Distrito: 29 (Ciudad Nezahualcóyotl) ,Licenciatura,Económico-financiera,LXII,2012-08-29,2015-08-31
venancioluissanchezjimenez,Venancio Luis Sánchez Jiménez,Senador Propietario,PRD,1962-05-18, México ,Representación Proporcional, N/A ,Pasante/Licenciatura trunca,Económico-financiera,LXII,2012-08-29,2015-08-31
veronicabeatrizjuarezpiña,Verónica Beatriz Juárez Piña,Diputada Propietario,PRD,1971-09-28, Jalisco ,Representación Proporcional, Jalisco Circunscripción: Primera ,Licenciatura,Derecho,LXII,2012-08-29,2015-08-31
veronicacarreoncervantes,Verónica Carreón Cervantes,Diputada Propietario,PRI,1970-07-03, Veracruz ,Mayoría Relativa, Veracruz Distrito: 7 (Martínez de la Torre) ,Maestría,Comunicación,LXII,2012-08-29,2015-08-31
veronicagarciareyes,Verónica García Reyes,Diputada Propietario,PRD,1977-08-23, Michoacán ,Representación Proporcional, Michoacán Circunscripción: Quinta ,Licenciatura,Derecho,LXII,2012-08-29,2015-08-31
veronicasadaperez,Verónica Sada Pérez,Diputada Propietario,PAN,1963-08-31, Nuevo León ,Representación Proporcional, Nuevo León Circunscripción: Segunda ,Licenciatura,Administración y contaduría,LXII,2012-08-29,2015-08-31
vianeymontescolunga,Vianey Montes Colunga,Senadora Suplente,PAN,1973-09-04, San Luis Potosí ,Mayoría Relativa, San Luis Potosí ,,,LXII,2012-08-29,2015-08-31
vicarioportillomartinez,Vicario Portillo Martínez,Diputado Propietario,PRD,1960-11-06, Guerrero ,Mayoría Relativa, Guerrero Distrito: 5 (Tlapa) ,Maestría,Ciencias de la educación,LXII,2012-08-29,2015-08-31
viridianalizetteespinocano,Viridiana Lizette Espino Cano,Diputada Suplente,PAN,1984-02-01, Guanajuato ,Mayoría Relativa, Guanajuato Distrito: 5 (León) ,,,LXII,2012-08-29,2015-08-31
victoremanueldiazpalacios,Víctor Emanuel Díaz Palacios,Diputado Propietario,PRI,1950-11-22, Puebla ,Mayoría Relativa, Puebla Distrito: 3 (Teziutlán) ,Licenciatura,Administración y contaduría,LXII,2012-08-29,2015-08-31
victorhermosilloycelada,Víctor Hermosillo y Celada,Senador Propietario,PAN,1939-08-28, Distrito Federal ,Mayoría Relativa, Baja California ,Licenciatura,Arquitectura y diseño,LXII,2012-08-29,2015-08-31
victormanuelbautistalopez,Víctor Manuel Bautista López,Diputado Propietario,PRD,1947-06-09, Tabasco ,Mayoría Relativa, México Distrito: 31 (Ciudad Nezahualcóyotl) ,Licenciatura,Comunicación,LXII,2012-08-29,2015-08-31
victormanueljorrinlozano,Víctor Manuel Jorrín Lozano,Diputado Propietario,MC,1955-01-13, Guerrero ,Mayoría Relativa, Guerrero Distrito: 4 (Acapulco de Juárez) ,Licenciatura,Psicología,LXII,2012-08-29,2015-08-31
victorrafaelgonzalezmanriquez,Víctor Rafael González Manríquez,Diputado Propietario,PAN,1959-05-23, Distrito Federal ,Representación Proporcional, Oaxaca Circunscripción: Tercera ,Licenciatura,Ingeniería,LXII,2012-08-29,2015-08-31
victorreymundonajeramedina,Víctor Reymundo Nájera Medina,Diputado Propietario,PRD,1955-07-04, Morelos ,Mayoría Relativa, Morelos Distrito: 5 (Yautepec) ,Maestría,Ciencias de la educación,LXII,2012-08-29,2015-08-31
victorserraldemartinez,Víctor Serralde Martínez,Diputado Propietario,PAN,1971-12-18, Veracruz ,Mayoría Relativa, Veracruz Distrito: 13 (Huatusco) ,Licenciatura,Ingeniería,LXII,2012-08-29,2015-08-31
williamrenansosaaltamira,William Renan Sosa Altamira,Diputado Propietario,PRI,1957-04-21, ,Mayoría Relativa, Yucatán Distrito: 1 (Valladolid) ,,,LXII,2012-08-29,2015-08-31
williamsoswaldoochoagallegos,Williams Oswaldo Ochoa Gallegos,Diputado Propietario,PRI,1978-06-06, Chiapas ,Mayoría Relativa, Chiapas Distrito: 6 (Tuxtla Gutiérrez) ,Licenciatura,Ciencias políticas y sociales,LXII,2012-08-29,2015-08-31
xavierazuarazuñiga,Xavier Azuara Zúñiga,Diputado Propietario,PAN,1979-09-16, San Luis Potosí ,Mayoría Relativa, San Luis Potosí Distrito: 5 (San Luis Potosí) ,Licenciatura,Administración y contaduría,LXII,2012-08-29,2015-08-31
yatzirimendozajimenez,Yatziri Mendoza  Jiménez,Diputada Suplente,PAN,1982-01-12, Guanajuato ,Mayoría Relativa, Guanajuato Distrito: 10 (Uriangato) ,,,LXII,2012-08-29,2015-08-31
yazmindelosangelescopetezapot,Yazmin de los Ángeles Copete Zapot,Diputada Propietario,PRD,1964-08-05, Veracruz ,Representación Proporcional, Veracruz Circunscripción: Tercera ,Licenciatura,Derecho,LXII,2012-08-29,2015-08-31
yesenianolascoramirez,Yesenia Nolasco Ramírez,Diputada Propietario,PRD,1982-08-22, Oaxaca ,Representación Proporcional, Distrito Federal Circunscripción: Cuarta ,Licenciatura,Derecho,LXII,2012-08-29,2015-08-31
zitabeatrizpazzimaza,Zita Beatriz Pazzi Maza,Diputada Propietario,PRI,1956-04-12, Veracruz ,Mayoría Relativa, Veracruz Distrito: 1 (Pánuco) ,Profesor Normalista,,LXII,2012-08-29,2015-08-31
zoealejandrorobledoaburto,Zoé Alejandro Robledo Aburto,Senador Propietario,PRD,1979-01-09, Chiapas ,Primera Minoría, Chiapas ,Maestría,Derecho,LXII,2012-08-29,2015-08-31
zuleymahuidobrogonzalez,Zuleyma Huidobro González,Diputada Propietario,MC,1978-06-30, Puebla ,Representación Proporcional, Puebla Circunscripción: Cuarta ,Licenciatura,Derecho,LXII,2012-08-29,2015-08-31
angelbenjaminroblesmontoya,Ángel Benjamín Robles Montoya,Senador Propietario,PRD,1959-11-08, Distrito Federal ,Mayoría Relativa, Oaxaca ,Licenciatura,Económico-financiera,LXII,2012-08-29,2015-08-31
angelcedillohernandez,Ángel Cedillo Hernández,Diputado Propietario,PRD,1960-10-01, México ,Representación Proporcional, México Circunscripción: Quinta ,,,LXII,2012-08-29,2015-08-31
oscarromanrosasgonzalez,Óscar Román Rosas González,Senador Propietario,PRI,1968-09-14, Campeche ,Mayoría Relativa, Campeche ,Doctorado,Ciencias políticas y sociales,LXII,2012-08-29,2015-08-31
aarongonzalezrojas,Aarón González Rojas,Diputado Suplente,PRI,1900-01-01, ,Mayoría Relativa, México Distrito: 2 (Teoloyucan) ,Licenciatura,Ingeniería,LXIII,2015-08-29,2018-08-31
aaronirizarlopez,Aarón Irízar López,Senador Propietario,PRI,1950-02-28, Sinaloa ,Mayoría Relativa, Sinaloa ,Maestría,Ciencias políticas y sociales,LXIII,2015-08-29,2018-08-31
abdiespinedamorin,Abdies Pineda Morín,Diputado Propietario,PES,1957-10-31, Tamaulipas ,Representación Proporcional, Tamaulipas Circunscripción: Segunda ,Secundaria,,LXIII,2015-08-29,2018-08-31
abelcruzhernandez,Abel Cruz Hernández,Diputado Propietario,PES,1900-01-01, ,Representación Proporcional, Hidalgo Circunscripción: Quinta ,Licenciatura,Ciencias de la salud,LXIII,2015-08-29,2018-08-31
abelmurrietagutierrez,Abel Murrieta Gutiérrez,Diputado Propietario,PRI,1963-05-01, Sonora ,Mayoría Relativa, Sonora Distrito: 6 (Ciudad Obregón) ,Licenciatura,Derecho,LXIII,2015-08-29,2018-08-31
adolfomotahernandez,Adolfo Mota Hernández,Diputado Propietario,PRI,1976-01-31, Veracruz ,Mayoría Relativa, Veracruz Distrito: 8 (Xalapa) ,Licenciatura,Derecho,LXIII,2015-08-29,2018-08-31
adolforomerolainas,Adolfo Romero Lainas,Senador Propietario,PRD,1958-10-12, Oaxaca ,Mayoría Relativa, Oaxaca ,Licenciatura,Ciencias de la salud,LXIII,2015-08-29,2018-08-31
adrianadavilafernandez,Adriana Dávila Fernández,Senadora Propietario,PAN,1970-12-30, Tlaxcala ,Primera Minoría, Tlaxcala ,Licenciatura,Comunicación,LXIII,2015-08-29,2018-08-31
adrianaelizarrarazsandoval,Adriana Elizarraraz Sandoval,Diputada Propietario,PAN,1986-01-02, Guanajuato ,Mayoría Relativa, Guanajuato Distrito: 12 (Celaya) ,Licenciatura,Otra,LXIII,2015-08-29,2018-08-31
adrianaloaizagarzon,Adriana Loaiza Garzón,Senadora Suplente,PAN,1900-01-01, ,Representación Proporcional, N/A ,Licenciatura,Económico-financiera,LXIII,2015-08-29,2018-08-31
