CURP,Nombre,TipoLegislacion,Partido,FechaNacimiento,LugarNacimiento,PrincipioEleccion,Zona,UltimoGradoEstudios,PreparacionAcademica,Legislatura,InicioLegislatura,FinLegislatura
carlarochinnieto,Carla Rochín Nieto,Diputada Propietario,PAN,1966-07-04, ,Mayoría Relativa, Guanajuato Distrito: 8 (Salamanca) ,,,LIX,2003-08-29,2006-08-31
carlosblackallerayala,Carlos Blackaller Ayala,Diputado Propietario,PRI,1963-03-03, Jalisco ,Representación Proporcional, N/A ,Licenciatura,Ingeniería,LIX,2003-08-29,2006-08-31
carloschaurandarzate,Carlos Chaurand Arzate,Senador Propietario,PRI,1951-07-07, Guanajuato ,Primera Minoría, Guanajuato ,Licenciatura,Derecho,LIX,2003-08-29,2006-08-31
carlosfloresrico,Carlos Flores Rico,Diputado Propietario,PRI,1952-10-21, Tamaulipas ,Representación Proporcional, N/A ,Licenciatura,Ciencias políticas y sociales,LIX,2003-08-29,2006-08-31
carloshernansilvavaldes,Carlos Hernán Silva Valdés,Diputado Propietario,PRD,1954-01-28, Michoacán ,Mayoría Relativa, Michoacán Distrito: 9 (Uruapan) ,,,LIX,2003-08-29,2006-08-31
carlosmadrazolimon,Carlos Madrazo Limón,Senador Propietario,PAN,1952-02-02, Distrito Federal ,Mayoría Relativa, México ,Maestría,Ingeniería,LIX,2003-08-29,2006-08-31
carlosmanuelrovirosaramirez,Carlos Manuel Rovirosa Ramírez,Diputado Propietario,PRI,1953-05-19, Tabasco ,Mayoría Relativa, Tabasco Distrito: 5 (Macuspana) ,,,LIX,2003-08-29,2006-08-31
carlosmanuelvillalobosorganista,Carlos Manuel Villalobos Organista,Senador Suplente,PAN,1951-09-01, Jalisco ,Mayoría Relativa, Sonora ,Maestría,Económico-financiera,LIX,2003-08-29,2006-08-31
carlosmartinjimenezmacias,Carlos Martín Jiménez Macías,Diputado Propietario,PRI,1950-05-01, San Luis Potosí ,Representación Proporcional, N/A ,,,LIX,2003-08-29,2006-08-31
carlosmedinaplascencia,Carlos Medina Plascencia,Senador Propietario,PAN,1955-08-14, Guanajuato ,Representación Proporcional, Guanajuato ,Maestría,Administración y contaduría,LIX,2003-08-29,2006-08-31
carlosmirelesmorales,Carlos Mireles Morales,Diputado Propietario,PRI,1937-10-18, Nuevo León ,Representación Proporcional, N/A ,,,LIX,2003-08-29,2006-08-31
carlosnoeltiscareñorodriguez,Carlos Noel Tiscareño Rodríguez,Diputado Propietario,PAN,1974-09-21, Jalisco ,Mayoría Relativa, Jalisco Distrito: 14 (Guadalajara) ,,,LIX,2003-08-29,2006-08-31
carlososwaldopanobecerra,Carlos Oswaldo Pano Becerra,Diputado Propietario,PRI,1959-05-29, Chiapas ,Mayoría Relativa, Chiapas Distrito: 12 (Tapachula) ,,,LIX,2003-08-29,2006-08-31
carlosrojasgutierrez,Carlos Rojas Gutiérrez,Senador Propietario,PRI,1954-11-04, Distrito Federal ,Representación Proporcional, Distrito Federal ,,,LIX,2003-08-29,2006-08-31
carmenguadalupefonzsaenz,Carmen Guadalupe Fonz Sáenz,Diputada Propietario,PRI,1954-06-22, Distrito Federal ,Representación Proporcional, N/A ,Profesor Normalista,,LIX,2003-08-29,2006-08-31
claramarinabrugadamolina,Clara Marina Brugada Molina,Diputada Propietario,PRD,1963-08-12, Distrito Federal ,Mayoría Relativa, Distrito Federal Distrito: 25 (Iztapalapa) ,Licenciatura,Económico-financiera,LIX,2003-08-29,2006-08-31
claudiaruizmassieusalinas,Claudia Ruiz Massieu Salinas,Diputada Propietario,PRI,1972-07-10, Distrito Federal ,Representación Proporcional, Distrito Federal Circunscripción: Cuarta ,,,LIX,2003-08-29,2006-08-31
concepcionolivacastañedaortiz,Concepción Oliva Castañeda Ortiz,Diputada Propietario,PRI,1952-12-08, Veracruz ,Representación Proporcional, N/A ,Licenciatura,Derecho,LIX,2003-08-29,2006-08-31
concepcionsofiaroblesaltamirano,Concepción Sofía Robles Altamirano,Diputada Suplente,PRI,1900-01-01, ,Mayoría Relativa, Oaxaca Distrito: 4 (Ixtlán de Juárez) ,Profesor Normalista,Ciencias de la educación,LIX,2003-08-29,2006-08-31
consuelocamarenagomez,Consuelo Camarena Gómez,Diputada Propietario,PAN,1943-04-27, Guanajuato ,Mayoría Relativa, Guanajuato Distrito: 9 (Irapuato) ,Maestría,Ciencias,LIX,2003-08-29,2006-08-31
consuelomurourista,Consuelo Muro Urista,Diputada Propietario,PRI,1963-09-11, ,Representación Proporcional, N/A ,Maestría,Administración y contaduría,LIX,2003-08-29,2006-08-31
cristinaportilloayala,Cristina Portillo Ayala,Diputada Propietario,PRD,1969-12-30, Michoacán ,Representación Proporcional, N/A ,,,LIX,2003-08-29,2006-08-31
cruzlopezaguilar,Cruz López Aguilar,Diputado Propietario,PRI,1947-05-03, Nuevo León ,Representación Proporcional, Tamaulipas Circunscripción: Segunda ,,,LIX,2003-08-29,2006-08-31
cuauhtemocochoafernandez,Cuauhtémoc Ochoa Fernández,Diputado Propietario,PVEM,1970-12-01, Distrito Federal ,Representación Proporcional, N/A ,,,LIX,2003-08-29,2006-08-31
cesaramingonzalezorantes,César Amín González Orantes,Diputado Propietario,PRI,1961-04-01, Chiapas ,Mayoría Relativa, Chiapas Distrito: 11 (Huixtla) ,,,LIX,2003-08-29,2006-08-31
cesarantoniochavezcastillo,César Antonio Chávez Castillo,Diputado Propietario,PRD,1951-12-31, Distrito Federal ,Representación Proporcional, N/A ,Maestría,Económico-financiera,LIX,2003-08-29,2006-08-31
cesaraugustocarrascogomez,César Augusto Carrasco Gómez,Diputado Suplente,PRI,1900-01-01, ,Mayoría Relativa, Oaxaca Distrito: 7 (Juchitán de Zaragoza) ,Licenciatura,Derecho,LIX,2003-08-29,2006-08-31
cesaroctaviocamachoquiroz,César Octavio Camacho Quiroz,Senador Propietario,PRI,1959-02-14, México ,Primera Minoría, México ,Licenciatura,Derecho,LIX,2003-08-29,2006-08-31
cesarraulojedazubieta,César Raúl Ojeda Zubieta,Senador Propietario,PRD,1952-07-20, Tabasco ,Primera Minoría, Tabasco ,,,LIX,2003-08-29,2006-08-31
danielordoñezhernandez,Daniel Ordóñez Hernández,Diputado Propietario,PRD,1968-06-13, Distrito Federal ,Mayoría Relativa, Distrito Federal Distrito: 14 (Iztacalco) ,,,LIX,2003-08-29,2006-08-31
danielraularevalogallegos,Daniel Raúl Arévalo Gallegos,Diputado Suplente,PRI,1962-05-21, ,Representación Proporcional, Distrito Federal Circunscripción: Cuarta ,,,LIX,2003-08-29,2006-08-31
davidferreyramartinez,David Ferreyra Martínez,Diputado Propietario,PRD,1973-09-20, Distrito Federal ,Mayoría Relativa, México Distrito: 28 (Nezahualcóyotl) ,,,LIX,2003-08-29,2006-08-31
davidhernandezperez,David Hernández Pérez,Diputado Propietario,PRI,1960-03-30, Jalisco ,Mayoría Relativa, Jalisco Distrito: 16 (Tlaquepaque) ,Pasante/Licenciatura trunca,Psicología,LIX,2003-08-29,2006-08-31
demetriojaviersodidelatijera,Demetrio Javier Sodi de la Tijera,Senador Propietario,Ind.,1944-09-25, Distrito Federal ,Primera Minoría, Distrito Federal ,,,LIX,2003-08-29,2006-08-31
diegofernandezdecevallosramos,Diego Fernández de Cevallos Ramos,Senador Propietario,PAN,1941-03-16, Distrito Federal ,Representación Proporcional, Querétaro ,Licenciatura,Derecho,LIX,2003-08-29,2006-08-31
diegopalmeroandrade,Diego Palmero Andrade,Diputado Propietario,PAN,1951-01-27, ,Mayoría Relativa, Veracruz Distrito: 17 (Cosamaloapan) ,,,LIX,2003-08-29,2006-08-31
divahadamiragastelumbajo,Diva Hadamira Gastélum Bajo,Diputada Propietario,PRI,1961-07-30, Sinaloa ,Representación Proporcional, N/A ,Maestría,Derecho,LIX,2003-08-29,2006-08-31
doloresdelcarmengutierrezzurita,Dolores del Carmen Gutiérrez Zurita,Diputada Propietario,PRD,1963-10-07, Tabasco ,Representación Proporcional, N/A ,,,LIX,2003-08-29,2006-08-31
dulcemariasauririancho,Dulce María Sauri Riancho,Senadora Propietario,PRI,1951-08-14, Yucatán ,Representación Proporcional, Yucatán ,Licenciatura,Ciencias políticas y sociales,LIX,2003-08-29,2006-08-31
edelmiragutierrezrios,Edelmira Gutiérrez Ríos,Diputada Propietario,PAN,1963-02-05, ,Representación Proporcional, N/A ,,,LIX,2003-08-29,2006-08-31
edgartorresbaltazar,Edgar Torres Baltazar,Diputado Propietario,PRD,1965-07-25, Distrito Federal ,Mayoría Relativa, Distrito Federal Distrito: 6 (Gustavo A. Madero) ,,,LIX,2003-08-29,2006-08-31
edmundogregoriovalenciamonterrubio,Edmundo Gregorio Valencia Monterrubio,Diputado Propietario,PAN,1946-11-18, ,Representación Proporcional, N/A ,,,LIX,2003-08-29,2006-08-31
eduardoalfonsosanchezhernandez,Eduardo Alfonso Sánchez Hernández,Diputado Propietario,Ind.,1946-10-30, Veracruz ,Mayoría Relativa, Veracruz Distrito: 3 (Tuxpan de Rodríguez Cano) ,,,LIX,2003-08-29,2006-08-31
eduardoovandomartinez,Eduardo Ovando Martínez,Senador Propietario,PRI,1955-10-13, Quintana Roo ,Mayoría Relativa, Quintana Roo ,,,LIX,2003-08-29,2006-08-31
elianagarcialaguna,Eliana García Laguna,Diputada Propietario,PRD,1958-02-21, ,Representación Proporcional, N/A ,,,LIX,2003-08-29,2006-08-31
elizabethosweliayañezrobles,Elizabeth Oswelia Yáñez Robles,Diputada Propietario,PAN,1945-09-29, Coahuila ,Mayoría Relativa, Guanajuato Distrito: 12 (Celaya) ,,,LIX,2003-08-29,2006-08-31
elpidiotovardelacruz,Elpidio Tovar de la Cruz,Diputado Propietario,PRD,1949-04-06, Nuevo León ,Representación Proporcional, N/A ,,,LIX,2003-08-29,2006-08-31
elsaobrajeromontes,Elsa Obrajero Montes,Diputada Suplente,PRD,1900-01-01, ,Mayoría Relativa, Distrito Federal Distrito: 20 (Iztapalapa) ,Pasante/Licenciatura trunca,Ciencias políticas y sociales,LIX,2003-08-29,2006-08-31
eliasmiguelmorenobrizuela,Elías Miguel Moreno Brizuela,Senador Propietario,PRD,1957-09-23, Veracruz ,Representación Proporcional, Veracruz ,Doctorado,Ciencias de la salud,LIX,2003-08-29,2006-08-31
emiliapatriciagomezbravo,Emilia Patricia Gómez Bravo,Senadora Propietario,PVEM,1954-10-06, Distrito Federal ,Mayoría Relativa, Distrito Federal ,Licenciatura,Ciencias políticas y sociales,LIX,2003-08-29,2006-08-31
emilianovladimirramoshernandez,Emiliano Vladimir Ramos Hernández,Diputado Suplente,PRD,1979-03-28, Quintana Roo ,Representación Proporcional, Campeche Circunscripción: Tercera ,Preparatoria,,LIX,2003-08-29,2006-08-31
emilioantoniogamboapatron,Emilio Antonio Gamboa Patrón,Senador Propietario,PRI,1950-08-23, Distrito Federal ,Representación Proporcional, Distrito Federal ,,,LIX,2003-08-29,2006-08-31
emiliobadilloramirez,Emilio Badillo Ramírez,Diputado Propietario,PRI,1950-09-22, Hidalgo ,Mayoría Relativa, Hidalgo Distrito: 1 (Huejutla de Reyes) ,Pasante/Licenciatura trunca,Ingeniería,LIX,2003-08-29,2006-08-31
emiliochuayffetchemor,Emilio Chuayffet Chemor,Diputado Propietario,PRI,1951-10-03, Distrito Federal ,Representación Proporcional, México Circunscripción: Quinta ,Licenciatura,Derecho,LIX,2003-08-29,2006-08-31
emilioserranojimenez,Emilio Serrano Jiménez,Diputado Propietario,PRD,1950-05-21, Distrito Federal ,Mayoría Relativa, Distrito Federal Distrito: 13 (Iztacalco) ,,,LIX,2003-08-29,2006-08-31
enriquearielescalantearceo,Enrique Ariel Escalante Arceo,Diputado Propietario,PRI,1969-05-23, Campeche ,Mayoría Relativa, Campeche Distrito: 1 (Campeche) ,Maestría,Económico-financiera,LIX,2003-08-29,2006-08-31
enriqueburgosgarcia,Enrique Burgos García,Diputado Propietario,PRI,1946-04-20, Querétaro ,Representación Proporcional, N/A ,Doctorado,Derecho,LIX,2003-08-29,2006-08-31
enriquetorrescuadros,Enrique Torres Cuadros,Diputado Propietario,PRD,1957-07-26, Michoacán ,Mayoría Relativa, Michoacán Distrito: 2 (Puruandiro) ,,,LIX,2003-08-29,2006-08-31
ericluisrubiobarthell,Eric Luis Rubio Barthell,Senador Propietario,PRI,1950-06-30, Distrito Federal ,Mayoría Relativa, Yucatán ,,,LIX,2003-08-29,2006-08-31
erickagustinsilvasantos,Erick Agustín Silva Santos,Diputado Suplente,PRI,1970-01-13, Tamaulipas ,Mayoría Relativa, Tamaulipas Distrito: 4 (Matamoros) ,Licenciatura,Ingeniería,LIX,2003-08-29,2006-08-31
ernestoalarcontrujillo,Ernesto Alarcón Trujillo,Diputado Propietario,PRI,1956-03-11, Veracruz ,Mayoría Relativa, Veracruz Distrito: 9 (Perote) ,Maestría,Ciencias políticas y sociales,LIX,2003-08-29,2006-08-31
ernestoherreratovar,Ernesto Herrera Tovar,Diputado Propietario,PAN,1972-05-19, ,Representación Proporcional, N/A ,,,LIX,2003-08-29,2006-08-31
estebanmiguelangelesceron,Esteban Miguel Ángeles Cerón,Senador Propietario,PRI,1946-02-08, Hidalgo ,Mayoría Relativa, Hidalgo ,Licenciatura,Económico-financiera,LIX,2003-08-29,2006-08-31
estebanvalenzuelagarcia,Esteban Valenzuela García,Diputado Propietario,PRI,1948-09-02, ,Mayoría Relativa, Sinaloa Distrito: 2 (Los Mochis) ,,,LIX,2003-08-29,2006-08-31
estheladejesusponcebeltran,Esthela de Jesús Ponce Beltrán,Diputada Propietario,PRI,1964-08-27, Baja California Sur ,Representación Proporcional, N/A ,,,LIX,2003-08-29,2006-08-31
eugeniomieryconchacampos,Eugenio Mier y Concha Campos,Diputado Propietario,PRI,1949-12-25, Tabasco ,Mayoría Relativa, Tabasco Distrito: 4 (Villahermosa) ,,,LIX,2003-08-29,2006-08-31
evangelinaperezzaragoza,Evangelina Pérez Zaragoza,Diputada Propietario,PAN,1950-08-02, Michoacán ,Representación Proporcional, N/A ,,,LIX,2003-08-29,2006-08-31
eveliasandovalurban,Evelia Sandoval Urban,Diputada Propietario,Ind.,1964-11-20, Oaxaca ,Mayoría Relativa, Jalisco Distrito: 13 (Guadalajara) ,Profesor Normalista,,LIX,2003-08-29,2006-08-31
fauzihamdanamad,Fauzi Hamdan Amad,Senador Propietario,PAN,1943-04-17, Distrito Federal ,Representación Proporcional, Distrito Federal ,Licenciatura,Derecho,LIX,2003-08-29,2006-08-31
federicobarbosagutierrez,Federico Barbosa Gutiérrez,Diputado Propietario,PRI,1952-04-27, Tlaxcala ,Mayoría Relativa, Tlaxcala Distrito: 3 (Chiautempan) ,Licenciatura,Derecho,LIX,2003-08-29,2006-08-31
federicodöringcasar,Federico Döring Casar,Diputado Propietario,PAN,1971-03-13, Distrito Federal ,Mayoría Relativa, Distrito Federal Distrito: 15 (Benito Juárez) ,,,LIX,2003-08-29,2006-08-31
felipemedinasantos,Felipe Medina Santos,Diputado Propietario,PRI,1948-12-27, México ,Mayoría Relativa, México Distrito: 33 (Chalco de Díaz Covarrubias) ,,,LIX,2003-08-29,2006-08-31
felipedejesusdiazgonzalez,Felipe de Jesús Díaz González,Diputado Propietario,PAN,1965-02-09, ,Representación Proporcional, N/A ,,,LIX,2003-08-29,2006-08-31
felipedejesusvicencioalvarez,Felipe de Jesús Vicencio Álvarez,Senador Propietario,PAN,1959-12-26, Distrito Federal ,Mayoría Relativa, Jalisco ,Licenciatura,Humanidades,LIX,2003-08-29,2006-08-31
fermintrujillofuentes,Fermín Trujillo Fuentes,Diputado Propietario,PRI,1966-09-18, Sonora ,Mayoría Relativa, Sonora Distrito: 2 (Magdalena de Kino) ,Maestría,Ciencias de la educación,LIX,2003-08-29,2006-08-31
fernandoalbertogarciacuevas,Fernando Alberto García Cuevas,Diputado Propietario,PRI,1953-04-02, Distrito Federal ,Mayoría Relativa, México Distrito: 2 (Zumpango de Ocampo) ,,,LIX,2003-08-29,2006-08-31
fernandoantonioguzmanperezpelaez,Fernando Antonio Guzmán Pérez Peláez,Diputado Propietario,PAN,1956-01-25, Distrito Federal ,Representación Proporcional, N/A ,,,LIX,2003-08-29,2006-08-31
fernandoespinoarevalo,Fernando Espino Arévalo,Diputado Propietario,PVEM,1949-02-22, Michoacán ,Representación Proporcional, N/A ,Maestría,Administración y contaduría,LIX,2003-08-29,2006-08-31
fernandofernandezgarcia,Fernando Fernández García,Diputado Propietario,PRI,1954-12-21, Puebla ,Mayoría Relativa, México Distrito: 12 (Texcoco de Mora) ,,,LIX,2003-08-29,2006-08-31
fernandogomezesparza,Fernando Gómez Esparza,Senador Propietario,PRI,1953-08-21, Aguascalientes ,Primera Minoría, Aguascalientes ,,,LIX,2003-08-29,2006-08-31
fernandomargainberlanga,Fernando Margáin Berlanga,Senador Propietario,PAN,1952-02-14, Nuevo León ,Mayoría Relativa, Nuevo León ,Maestría,Derecho,LIX,2003-08-29,2006-08-31
fernandoulisesadamedeleon,Fernando Ulises Adame de León,Diputado Propietario,PRI,1959-06-27, Durango ,Mayoría Relativa, Durango Distrito: 3 (Lerdo) ,Doctorado,Agropecuaria y zootecnia,LIX,2003-08-29,2006-08-31
fernandoalvarezmonje,Fernando Álvarez Monje,Diputado Propietario,PAN,1968-02-04, Chihuahua ,Mayoría Relativa, Chihuahua Distrito: 5 (Delicias) ,Licenciatura,Derecho,LIX,2003-08-29,2006-08-31
fidelrenemezacabrera,Fidel René Meza Cabrera,Diputado Propietario,Ind.,1943-11-12, Puebla ,Mayoría Relativa, Puebla Distrito: 1 (Huauchinango) ,,,LIX,2003-08-29,2006-08-31
filemonprimitivoarcossuarezperedo,Filemón Primitivo Arcos Suárez Peredo,Diputado Propietario,PRI,1945-06-10, Veracruz ,Representación Proporcional, N/A ,Pasante/Licenciatura trunca,Arquitectura y diseño,LIX,2003-08-29,2006-08-31
filomenamargaizramirez,Filomena Margaiz Ramírez,Senadora Suplente,PAN,1968-11-29, Guanajuato ,Mayoría Relativa, Guanajuato ,Maestría,Económico-financiera,LIX,2003-08-29,2006-08-31
florenciocollazogomez,Florencio Collazo Gómez,Diputado Propietario,PRI,1964-03-01, Chiapas ,Mayoría Relativa, Chiapas Distrito: 5 (San Cristóbal de las Casas) ,,,LIX,2003-08-29,2006-08-31
florentinodominguezordoñez,Florentino Domínguez Ordóñez,Diputado Propietario,PRI,1962-10-16, Tlaxcala ,Mayoría Relativa, Tlaxcala Distrito: 2 (Tlaxcala) ,,,LIX,2003-08-29,2006-08-31
franciscoagustinarroyovieyra,Francisco Agustín Arroyo Vieyra,Diputado Propietario,PRI,1959-04-16, Guanajuato ,Mayoría Relativa, Guanajuato Distrito: 4 (Guanajuato) ,Licenciatura,Derecho,LIX,2003-08-29,2006-08-31
franciscoamadeoespinosaramos,Francisco Amadeo Espinosa Ramos,Diputado Propietario,PT,1954-04-01, Chiapas ,Representación Proporcional, Campeche Circunscripción: Tercera ,Pasante/Licenciatura trunca,Ciencias de la educación,LIX,2003-08-29,2006-08-31
franciscoantoniofrailegarcia,Francisco Antonio Fraile García,Senador Propietario,PAN,1948-09-19, Oaxaca ,Primera Minoría, Puebla ,Maestría,Administración y contaduría,LIX,2003-08-29,2006-08-31
franciscobarrioterrazas,Francisco Barrio Terrazas,Diputado Propietario,PAN,1950-11-25, Chihuahua ,Representación Proporcional, Chihuahua Circunscripción: Segunda ,Maestría,Administración y contaduría,LIX,2003-08-29,2006-08-31
franciscobojorquezmungaray,Francisco Bojórquez Mungaray,Senador Suplente,PRI,1935-08-02, Sonora ,Primera Minoría, Sonora ,,,LIX,2003-08-29,2006-08-31
franciscochavarriavaldeolivar,Francisco Chavarría Valdeolívar,Diputado Propietario,PRD,1954-04-02, Guerrero ,Mayoría Relativa, Guerrero Distrito: 3 (José Azueta) ,Maestría,Ciencias de la educación,LIX,2003-08-29,2006-08-31
franciscocuauhtemocfriascastro,Francisco Cuauhtémoc Frías Castro,Diputado Propietario,PRI,1950-01-09, Sinaloa ,Mayoría Relativa, Sinaloa Distrito: 1 (El Fuerte) ,,,LIX,2003-08-29,2006-08-31
franciscodiegoaguilar,Francisco Diego Aguilar,Diputado Suplente,PRD,1972-06-12, ,Mayoría Relativa, Distrito Federal Distrito: 22 (Iztapalapa) ,Licenciatura,Ciencias políticas y sociales,LIX,2003-08-29,2006-08-31
franciscofernandezdecevallosyurueta,Francisco Fernández de Cevallos y Urueta,Senador Propietario,PAN,1947-07-04, Querétaro ,Mayoría Relativa, Querétaro ,,,LIX,2003-08-29,2006-08-31
franciscofloresgonzalez,Francisco Flores González,Diputado Suplente,PAN,1900-01-01, ,Representación Proporcional, Distrito Federal Circunscripción: Cuarta ,Licenciatura,Derecho,LIX,2003-08-29,2006-08-31
franciscograjalespalacios,Francisco Grajales Palacios,Diputado Propietario,PRI,1956-08-18, Chiapas ,Mayoría Relativa, Chiapas Distrito: 7 (Tonalá) ,,,LIX,2003-08-29,2006-08-31
franciscoherreraleon,Francisco Herrera León,Diputado Propietario,PRI,1966-09-16, Tabasco ,Mayoría Relativa, Tabasco Distrito: 1 (Frontera) ,,,LIX,2003-08-29,2006-08-31
franciscoisaiaslemusmuñozledo,Francisco Isaías Lemus Muñoz Ledo,Diputado Propietario,PAN,1961-02-23, Guanajuato ,Mayoría Relativa, Guanajuato Distrito: 10 (Apaseo el Grande) ,,,LIX,2003-08-29,2006-08-31
franciscojavierbravocarbajal,Francisco Javier Bravo Carbajal,Diputado Propietario,PRI,1967-02-18, Jalisco ,Mayoría Relativa, Jalisco Distrito: 5 (Puerto Vallarta) ,Licenciatura,Derecho,LIX,2003-08-29,2006-08-31
franciscojaviercarrillosoberon,Francisco Javier Carrillo Soberón,Diputado Propietario,PRD,1951-08-10, México ,Mayoría Relativa, Distrito Federal Distrito: 5 (Azcapotzalco) ,Licenciatura,Arquitectura y diseño,LIX,2003-08-29,2006-08-31
franciscojavierlaraarano,Francisco Javier Lara Arano,Diputado Propietario,PAN,1959-06-09, ,Representación Proporcional, N/A ,,,LIX,2003-08-29,2006-08-31
franciscojavierobregonespinoza,Francisco Javier Obregón Espinoza,Diputado Propietario,PRD,1958-01-28, Baja California Sur ,Mayoría Relativa, Baja California Sur Distrito: 1 (Santa Rosalía) ,,,LIX,2003-08-29,2006-08-31
franciscojaviersaucedoperez,Francisco Javier Saucedo Pérez,Diputado Propietario,PRD,1955-04-24, Jalisco ,Mayoría Relativa, Distrito Federal Distrito: 12 (Cuauhtémoc) ,,,LIX,2003-08-29,2006-08-31
franciscojaviervaldesdeanda,Francisco Javier Valdés de Anda,Diputado Propietario,PAN,1956-10-19, ,Mayoría Relativa, Aguascalientes Distrito: 2 (Aguascalientes) ,,,LIX,2003-08-29,2006-08-31
franciscojoserojasgutierrez,Francisco José Rojas Gutiérrez,Diputado Propietario,PRI,1944-09-15, Distrito Federal ,Representación Proporcional, Distrito Federal Circunscripción: Cuarta ,,,LIX,2003-08-29,2006-08-31
franciscojuanavilacamberos,Francisco Juan Ávila Camberos,Diputado Propietario,PAN,1948-12-13, Veracruz ,Mayoría Relativa, Veracruz Distrito: 12 (Veracruz) ,Licenciatura,Ingeniería,LIX,2003-08-29,2006-08-31
franciscoluismonarrezrincon,Francisco Luis Monárrez Rincón,Diputado Propietario,PRI,1950-08-05, Durango ,Mayoría Relativa, Durango Distrito: 1 (Santiago Papasquiaro) ,,,LIX,2003-08-29,2006-08-31
franciscomoracipres,Francisco Mora Ciprés,Diputado Propietario,PRD,1961-07-16, ,Representación Proporcional, N/A ,,,LIX,2003-08-29,2006-08-31
franciscosuarezydavila,Francisco Suárez y Dávila,Diputado Propietario,PRI,1943-04-20, Distrito Federal ,Representación Proporcional, N/A ,,,LIX,2003-08-29,2006-08-31
franciscoxavieralvaradovillazon,Francisco Xavier Alvarado Villazón,Diputado Propietario,PVEM,1978-09-23, ,Representación Proporcional, N/A ,Licenciatura,Económico-financiera,LIX,2003-08-29,2006-08-31
franciscoxavierlopezmena,Francisco Xavier López Mena,Diputado Propietario,PAN,1953-08-15, ,Representación Proporcional, N/A ,,,LIX,2003-08-29,2006-08-31
gabrielaruizdelrincon,Gabriela Ruiz del Rincón,Diputada Propietario,PAN,1956-05-07, Sinaloa ,Representación Proporcional, N/A ,Maestría,Comunicación,LIX,2003-08-29,2006-08-31
gasparavilarodriguez,Gaspar Ávila Rodríguez,Diputado Propietario,PRI,1946-01-06, México ,Mayoría Relativa, México Distrito: 5 (Teotihuacan) ,Pasante/Licenciatura trunca,Económico-financiera,LIX,2003-08-29,2006-08-31
gelaciomontielfuentes,Gelacio Montiel Fuentes,Diputado Propietario,PRD,1961-11-21, Tlaxcala ,Mayoría Relativa, Tlaxcala Distrito: 1 (Apizaco) ,,,LIX,2003-08-29,2006-08-31
gemaisabelmartinezlopez,Gema Isabel Martínez López,Diputada Propietario,PRI,1950-11-28, Distrito Federal ,Representación Proporcional, N/A ,,,LIX,2003-08-29,2006-08-31
genaroborregoestrada,Genaro Borrego Estrada,Senador Propietario,Ind.,1949-02-28, Zacatecas ,Mayoría Relativa, Zacatecas ,Licenciatura,Ciencias políticas y sociales,LIX,2003-08-29,2006-08-31
georginatrujillozentella,Georgina Trujillo Zentella,Senadora Propietario,PRI,1962-12-17, Distrito Federal ,Mayoría Relativa, Tabasco ,Licenciatura,Administración y contaduría,LIX,2003-08-29,2006-08-31
gerardobuganzasalmeron,Gerardo Buganza Salmerón,Senador Propietario,PAN,1956-05-24, Veracruz ,Primera Minoría, Veracruz ,Maestría,Ciencias políticas y sociales,LIX,2003-08-29,2006-08-31
gerardomontenegroibarra,Gerardo Montenegro Ibarra,Diputado Propietario,PRI,1966-01-10, Nayarit ,Mayoría Relativa, Nayarit Distrito: 2 (Tepic) ,,,LIX,2003-08-29,2006-08-31
gerardoulloaperez,Gerardo Ulloa Pérez,Diputado Propietario,PRD,1965-10-29, Chiapas ,Mayoría Relativa, México Distrito: 30 (Nezahualcóyotl) ,,,LIX,2003-08-29,2006-08-31
germanmartinezcazares,Germán Martínez Cázares,Diputado Propietario,PAN,1967-06-20, Michoacán ,Representación Proporcional, N/A ,Doctorado,Derecho,LIX,2003-08-29,2006-08-31
germansierrasanchez,Germán Sierra Sánchez,Senador Propietario,PRI,1956-09-27, Puebla ,Mayoría Relativa, Puebla ,,,LIX,2003-08-29,2006-08-31
gildardogomezveronica,Gildardo Gómez Verónica,Senador Propietario,PAN,1942-07-24, Jalisco ,Mayoría Relativa, Jalisco ,Licenciatura,Derecho,LIX,2003-08-29,2006-08-31
giovannaguiomaraortegamillet,Giovanna Guiomara Ortega Millet,Diputada Suplente,PRI,1900-01-01, ,Representación Proporcional, Campeche Circunscripción: Tercera ,,,LIX,2003-08-29,2006-08-31
giselajulianalarasaldaña,Gisela Juliana Lara Saldaña,Diputada Propietario,PAN,1956-09-18, ,Representación Proporcional, N/A ,,,LIX,2003-08-29,2006-08-31
gloriaangelaberthalavaramejia,Gloria Ángela Bertha Lavara Mejía,Senadora Propietario,PVEM,1971-12-09, Distrito Federal ,Representación Proporcional, Distrito Federal ,Licenciatura,Otra,LIX,2003-08-29,2006-08-31
gonzaloalemanmigliolo,Gonzalo Alemán Migliolo,Diputado Propietario,PRI,1945-05-10, Tamaulipas ,Mayoría Relativa, Tamaulipas Distrito: 7 (Ciudad Madero) ,Licenciatura,Derecho,LIX,2003-08-29,2006-08-31
gonzaloguizarvalladares,Gonzalo Guízar Valladares,Diputado Propietario,PRI,1961-04-27, Veracruz ,Mayoría Relativa, Veracruz Distrito: 22 (Coatzacoalcos) ,,,LIX,2003-08-29,2006-08-31
gonzalomorenoarevalo,Gonzalo Moreno Arévalo,Diputado Propietario,PRI,1958-08-21, ,Mayoría Relativa, Jalisco Distrito: 6 (Zapopan) ,,,LIX,2003-08-29,2006-08-31
gonzalorodriguezanaya,Gonzalo Rodríguez Anaya,Diputado Propietario,PRI,1942-10-21, Hidalgo ,Mayoría Relativa, Hidalgo Distrito: 3 (Atotonilco el Grande) ,,,LIX,2003-08-29,2006-08-31
gracielalariosrivas,Graciela Larios Rivas,Diputada Propietario,PRI,1950-02-10, Colima ,Representación Proporcional, Colima Circunscripción: Primera ,,,LIX,2003-08-29,2006-08-31
guillermodelvallereyes,Guillermo Del Valle Reyes,Diputado Propietario,PRI,1964-02-28, Oaxaca ,Mayoría Relativa, Morelos Distrito: 3 (Cuautla) ,,,LIX,2003-08-29,2006-08-31
guillermoenriquemarcostamborrelsuarez,Guillermo Enrique Marcos Tamborrel Suárez,Diputado Propietario,PAN,1960-04-25, Distrito Federal ,Mayoría Relativa, Querétaro Distrito: 3 (Querétaro) ,,,LIX,2003-08-29,2006-08-31
