CURP,Nombre,TipoLegislacion,Partido,FechaNacimiento,LugarNacimiento,PrincipioEleccion,Zona,UltimoGradoEstudios,PreparacionAcademica,Legislatura,InicioLegislatura,FinLegislatura
alejandrogonzalezalcocer,Alejandro González Alcocer,Senador Propietario,PAN,1951-04-24, Distrito Federal ,Mayoría Relativa, Baja California ,Licenciatura,Derecho,LXI,2009-08-29,2012-08-31
alejandrogonzalezyañez,Alejandro González Yáñez,Senador Propietario,PT,1956-09-09, Distrito Federal ,Representación Proporcional, Durango ,Licenciatura,Económico-financiera,LXI,2009-08-29,2012-08-31
alejandrodejesusencinasrodriguez,Alejandro de Jesús Encinas Rodríguez,Diputado Propietario,PRD,1954-05-13, Distrito Federal ,Representación Proporcional, Distrito Federal Circunscripción: Cuarta ,Licenciatura,Económico-financiera,LXI,2009-08-29,2012-08-31
alfonsoabrahamsanchezanaya,Alfonso Abraham Sánchez Anaya,Senador Propietario,PRD,1941-01-23, Tlaxcala ,Mayoría Relativa, Tlaxcala ,Licenciatura,Agropecuaria y zootecnia,LXI,2009-08-29,2012-08-31
alfonsoeliasserrano,Alfonso Elías Serrano,Senador Propietario,PRI,1960-08-17, Sonora ,Primera Minoría, Sonora ,Licenciatura,Administración y contaduría,LXI,2009-08-29,2012-08-31
alfonsoprimitivoriosvazquez,Alfonso Primitivo Ríos Vázquez,Diputado Suplente,PT,1955-06-10, Durango ,Representación Proporcional, Durango Circunscripción: Primera ,Licenciatura,Ciencias de la educación,LXI,2009-08-29,2012-08-31
alfredofranciscolugooñate,Alfredo Francisco Lugo Oñate,Diputado Propietario,PRI,1958-11-11, Querétaro ,Mayoría Relativa, Querétaro Distrito: 3 (Santiago de Querétaro) ,Maestría,Administración y contaduría,LXI,2009-08-29,2012-08-31
alfredojavierrodriguezdavila,Alfredo Javier Rodríguez  Dávila,Diputado Propietario,PAN,1969-08-12, Nuevo León ,Mayoría Relativa, Nuevo León Distrito: 10 (Monterrey) ,Licenciatura,Ingeniería,LXI,2009-08-29,2012-08-31
alfredorodriguezypacheco,Alfredo Rodríguez y Pacheco,Senador Propietario,PAN,1959-08-11, Yucatán ,Mayoría Relativa, Yucatán ,Licenciatura,Administración y contaduría,LXI,2009-08-29,2012-08-31
alfredovillegasarreola,Alfredo Villegas Arreola,Diputado Propietario,PRI,1951-01-12, Sinaloa ,Representación Proporcional, Sinaloa Circunscripción: Primera ,Licenciatura,Ingeniería,LXI,2009-08-29,2012-08-31
almacarolinaviggianoaustria,Alma Carolina Viggiano Austria,Diputada Propietario,PRI,1968-07-06, Hidalgo ,Mayoría Relativa, Hidalgo Distrito: 6 (Pachuca de Soto) ,Licenciatura,Derecho,LXI,2009-08-29,2012-08-31
amiragriceldagomeztueme,Amira Gricelda Gómez Tueme,Senadora Propietario,PRI,1954-09-21, Nuevo León ,Primera Minoría, Tamaulipas ,Licenciatura,Administración y contaduría,LXI,2009-08-29,2012-08-31
anaeliaparedesarciga,Ana Elia Paredes Arciga,Diputada Propietario,PAN,1964-07-26, ,Representación Proporcional, Jalisco Circunscripción: Primera ,Técnico,Ciencias de la salud,LXI,2009-08-29,2012-08-31
anaesteladuranrico,Ana Estela Durán Rico,Diputada Propietario,PRI,1955-08-05, ,Mayoría Relativa, Jalisco Distrito: 13 (Guadalajara) ,Licenciatura,Derecho,LXI,2009-08-29,2012-08-31
anageorginazapatalucero,Ana Georgina Zapata Lucero,Diputada Suplente,PRI,1981-04-12, ,Mayoría Relativa, Chihuahua Distrito: 2 (Ciudad Juárez) ,Licenciatura,Derecho,LXI,2009-08-29,2012-08-31
analuzlobatoramirez,Ana Luz Lobato Ramírez,Diputada Propietario,Ind.,1970-04-27, ,Representación Proporcional, Guerrero Circunscripción: Cuarta ,Licenciatura,Ciencias de la educación,LXI,2009-08-29,2012-08-31
anamariarojasruiz,Ana María Rojas Ruiz,Diputada Propietario,PRI,1969-01-20, ,Representación Proporcional, Chiapas Circunscripción: Tercera ,Licenciatura,Derecho,LXI,2009-08-29,2012-08-31
andresgalvanrivas,Andrés Galván Rivas,Senador Propietario,PAN,1960-08-29, Durango ,Mayoría Relativa, Durango ,Licenciatura,Derecho,LXI,2009-08-29,2012-08-31
andresmassieufernandez,Andrés Massieu Fernández,Diputado Propietario,PRI,1977-11-05, México ,Representación Proporcional, México Circunscripción: Quinta ,Maestría,Ciencias políticas y sociales,LXI,2009-08-29,2012-08-31
antelmoalvaradogarcia,Antelmo Alvarado García,Senador Suplente,PRI,1900-01-01, Guerrero ,Primera Minoría, Guerrero ,,,LXI,2009-08-29,2012-08-31
antoninocayetanodiaz,Antonino Cayetano Díaz,Diputado Suplente,PRD,1900-01-01, ,Representación Proporcional, Guerrero Circunscripción: Cuarta ,,,LXI,2009-08-29,2012-08-31
antoniobenitezlucho,Antonio Benítez Lucho,Diputado Propietario,PRI,1955-01-17, Veracruz ,Mayoría Relativa, Veracruz Distrito: 21 (Cosoleacaque) ,Licenciatura,Derecho,LXI,2009-08-29,2012-08-31
antoniomejiaharo,Antonio Mejía Haro,Senador Propietario,PRD,1957-06-10, Zacatecas ,Mayoría Relativa, Zacatecas ,Maestría,Agropecuaria y zootecnia,LXI,2009-08-29,2012-08-31
anibalperaltagalicia,Aníbal Peralta Galicia,Diputado Suplente,PRI,1947-07-13, Veracruz ,Mayoría Relativa, Veracruz Distrito: 9 (Coatepec) ,,,LXI,2009-08-29,2012-08-31
aranzazuquintanapadilla,Aranzazú Quintana Padilla,Diputada Suplente,PAN,1979-05-04, Distrito Federal ,Mayoría Relativa, Guanajuato Distrito: 1 (San Luis de la Paz) ,Licenciatura,Derecho,LXI,2009-08-29,2012-08-31
arielgomezleon,Ariel Gómez León,Diputado Propietario,PRD,1965-09-30, Chiapas ,Mayoría Relativa, Chiapas Distrito: 9 (Tuxtla Gutiérrez) ,Técnico,Comunicación,LXI,2009-08-29,2012-08-31
armandocontrerascastillo,Armando Contreras Castillo,Senador Suplente,PRD,1900-01-01, ,Mayoría Relativa, Oaxaca ,Licenciatura,,LXI,2009-08-29,2012-08-31
armandocoronarivera,Armando Corona Rivera,Diputado Propietario,PRI,1966-02-17, México ,Mayoría Relativa, México Distrito: 12 (Ixtapaluca) ,Licenciatura,Administración y contaduría,LXI,2009-08-29,2012-08-31
armandojesusbaezpinal,Armando Jesús Baez Pinal,Diputado Propietario,PRI,1961-09-30, Distrito Federal ,Representación Proporcional, Distrito Federal Circunscripción: Cuarta ,Técnico,Otra,LXI,2009-08-29,2012-08-31
armandoneyrachavez,Armando Neyra Chávez,Diputado Propietario,PRI,1937-02-18, México ,Representación Proporcional, México Circunscripción: Quinta ,Preparatoria,,LXI,2009-08-29,2012-08-31
armandoriospiter,Armando Ríos Piter,Diputado Propietario,PRD,1973-02-21, Guerrero ,Mayoría Relativa, Guerrero Distrito: 3 (Zihuatanejo) ,Maestría,Ciencias políticas y sociales,LXI,2009-08-29,2012-08-31
arturoescobaryvega,Arturo Escobar y Vega,Senador Propietario,PVEM,1970-04-23, Distrito Federal ,Representación Proporcional, Distrito Federal ,Maestría,Derecho,LXI,2009-08-29,2012-08-31
arturogarciaportillo,Arturo García Portillo,Diputado Propietario,PAN,1966-11-22, Chihuahua ,Representación Proporcional, Chihuahua Circunscripción: Primera ,Licenciatura,Ciencias,LXI,2009-08-29,2012-08-31
arturohervizreyes,Arturo Herviz Reyes,Senador Propietario,PRD,1954-07-12, Veracruz ,Mayoría Relativa, Veracruz ,Licenciatura,Derecho,LXI,2009-08-29,2012-08-31
arturoramirezbucio,Arturo Ramírez Bucio,Diputado Propietario,PAN,1962-05-07, Distrito Federal ,Representación Proporcional, Zacatecas Circunscripción: Segunda ,Maestría,Administración y contaduría,LXI,2009-08-29,2012-08-31
arturosantanaalfaro,Arturo Santana Alfaro,Diputado Propietario,PRD,1971-06-28, Distrito Federal ,Mayoría Relativa, Distrito Federal Distrito: 22 (Iztapalapa) ,Licenciatura,Derecho,LXI,2009-08-29,2012-08-31
arturovillaseñorfernandez,Arturo Villaseñor Fernández,Diputado Suplente,PAN,1973-05-30, ,Mayoría Relativa, Jalisco Distrito: 10 (Zapopan) ,,,LXI,2009-08-29,2012-08-31
arturozamorajimenez,Arturo Zamora Jiménez,Diputado Propietario,PRI,1956-03-30, Jalisco ,Mayoría Relativa, Jalisco Distrito: 4 (Zapopan) ,Doctorado,Derecho,LXI,2009-08-29,2012-08-31
augustavalentinadiazderiverahernandez,Augusta Valentina Díaz de Rivera Hernández,Diputada Propietario,PAN,1961-01-10, Puebla ,Representación Proporcional, Puebla Circunscripción: Cuarta ,Maestría,Ciencias políticas y sociales,LXI,2009-08-29,2012-08-31
augustocesarlealangulo,Augusto César Leal Angulo,Senador Propietario,PAN,1931-06-03, Sinaloa ,Representación Proporcional, Sinaloa ,Licenciatura,Ciencias,LXI,2009-08-29,2012-08-31
avelinomendezrangel,Avelino Méndez Rangel,Diputado Propietario,PRD,1958-11-26, Distrito Federal ,Mayoría Relativa, Distrito Federal Distrito: 21 (Xochimilco) ,Licenciatura,Agropecuaria y zootecnia,LXI,2009-08-29,2012-08-31
balfrevargascortez,Balfre Vargas Cortez,Diputado Propietario,PRD,1959-01-30, ,Mayoría Relativa, Distrito Federal Distrito: 3 (Azcapotzalco) ,Profesor Normalista,Ciencias de la educación,LXI,2009-08-29,2012-08-31
baltazarmanuelhinojosaochoa,Baltazar Manuel Hinojosa Ochoa,Diputado Propietario,PRI,1963-09-15, Tamaulipas ,Mayoría Relativa, Tamaulipas Distrito: 4 (H. Matamoros) ,Licenciatura,Económico-financiera,LXI,2009-08-29,2012-08-31
baltazarmartinezmontemayor,Baltazar Martínez Montemayor,Diputado Propietario,PAN,1966-08-31, Nuevo León ,Representación Proporcional, Nuevo León Circunscripción: Segunda ,Licenciatura,Administración y contaduría,LXI,2009-08-29,2012-08-31
benignoquezadanaranjo,Benigno Quezada Naranjo,Diputado Propietario,PAN,1962-06-18, Michoacán ,Representación Proporcional, Michoacán Circunscripción: Quinta ,Licenciatura,Otra,LXI,2009-08-29,2012-08-31
benjaminclariondreyesretana,Benjamín Clariond Reyes Retana,Diputado Propietario,PRI,1948-11-23, Nuevo León ,Representación Proporcional, Nuevo León Circunscripción: Segunda ,Licenciatura,Administración y contaduría,LXI,2009-08-29,2012-08-31
bernardomargaritotellezjuarez,Bernardo Margarito Téllez Juárez,Diputado Propietario,PAN,1954-02-11, Puebla ,Representación Proporcional, Veracruz Circunscripción: Tercera ,Licenciatura,Ciencias de la salud,LXI,2009-08-29,2012-08-31
blancaestelajimenezhernandez,Blanca Estela Jiménez Hernández,Diputada Propietario,PRI,1964-11-30, Puebla ,Mayoría Relativa, Puebla Distrito: 9 (Heroica Puebla de Zaragoza) ,Licenciatura,Derecho,LXI,2009-08-29,2012-08-31
blancajuanasoriamorales,Blanca Juana Soria Morales,Diputada Suplente,PRI,1975-05-17, México ,Mayoría Relativa, México Distrito: 31 (Ciudad Nezahualcóyotl) ,Preparatoria,,LXI,2009-08-29,2012-08-31
blancajudithdiazdelgado,Blanca Judith Díaz Delgado,Senadora Propietario,PAN,1958-02-22, Distrito Federal ,Mayoría Relativa, Nuevo León ,Licenciatura,Comunicación,LXI,2009-08-29,2012-08-31
blancaluzpurificaciondalilasotoplata,Blanca Luz Purificación Dalila Soto Plata,Diputada Suplente,PRI,1951-09-14, ,Mayoría Relativa, Hidalgo Distrito: 4 (Tulancingo de Bravo) ,,,LXI,2009-08-29,2012-08-31
bonifacioherrerarivera,Bonifacio Herrera Rivera,Diputado Propietario,PAN,1961-03-14, Durango ,Representación Proporcional, Durango Circunscripción: Primera ,Licenciatura,Administración y contaduría,LXI,2009-08-29,2012-08-31
belgicanabilcarmonacabrera,Bélgica Nabil Carmona Cabrera,Diputada Propietario,PRD,1987-01-01, Oaxaca ,Representación Proporcional, Oaxaca Circunscripción: Tercera ,Preparatoria,,LXI,2009-08-29,2012-08-31
camiloramirezpuente,Camilo Ramírez Puente,Diputado Propietario,PAN,1959-07-17, San Luis Potosí ,Mayoría Relativa, Nuevo León Distrito: 4 (San Nicolás de los Garza) ,Licenciatura,Derecho,LXI,2009-08-29,2012-08-31
caritinasaenzvargas,Caritina Sáenz Vargas,Diputada Suplente,PVEM,1963-08-08, México ,Representación Proporcional, México Circunscripción: Quinta ,Licenciatura,Administración y contaduría,LXI,2009-08-29,2012-08-31
carlosalbertoezetasalcedo,Carlos Alberto Ezeta Salcedo,Diputado Suplente,PVEM,1970-09-19, ,Representación Proporcional, Querétaro Circunscripción: Segunda ,Maestría,Derecho,LXI,2009-08-29,2012-08-31
carlosalbertoperezcuevas,Carlos Alberto Pérez Cuevas,Diputado Propietario,PAN,1974-03-24, México ,Representación Proporcional, México Circunscripción: Quinta ,Doctorado,Derecho,LXI,2009-08-29,2012-08-31
carlosbellootero,Carlos Bello Otero,Diputado Propietario,PAN,1966-08-09, Guerrero ,Mayoría Relativa, México Distrito: 15 (Tlalnepantla de Baz) ,Maestría,Ciencias políticas y sociales,LXI,2009-08-29,2012-08-31
carloscruzmendoza,Carlos Cruz Mendoza,Diputado Propietario,PRI,1960-01-19, Colima ,Mayoría Relativa, Colima Distrito: 2 (Manzanillo) ,Licenciatura,Ciencias,LXI,2009-08-29,2012-08-31
carlosfloresrico,Carlos Flores Rico,Diputado Propietario,PRI,1952-10-21, Tamaulipas ,Representación Proporcional, Tamaulipas Circunscripción: Segunda ,Licenciatura,Ciencias políticas y sociales,LXI,2009-08-29,2012-08-31
carloshumbertoacevesdelolmo,Carlos Humberto Aceves del Olmo,Senador Propietario,PRI,1940-11-05, Distrito Federal ,Representación Proporcional, Distrito Federal ,,,LXI,2009-08-29,2012-08-31
carlosluismeillonjohnston,Carlos Luis Meillon Johnston,Diputado Propietario,PAN,1951-01-24, Chihuahua ,Mayoría Relativa, Jalisco Distrito: 18 (Autlán de Navarro) ,Licenciatura,Ingeniería,LXI,2009-08-29,2012-08-31
carlosmanueljoaquingonzalez,Carlos Manuel Joaquín González,Diputado Propietario,PRI,1965-01-06, Quintana Roo ,Mayoría Relativa, Quintana Roo Distrito: 3 (Cancún) ,Licenciatura,Administración y contaduría,LXI,2009-08-29,2012-08-31
carlosmartinjimenezmacias,Carlos Martín Jiménez Macías,Senador Propietario,PRI,1950-05-01, San Luis Potosí ,Primera Minoría, San Luis Potosí ,Licenciatura,Humanidades,LXI,2009-08-29,2012-08-31
carlosmartinezmartinez,Carlos Martínez Martínez,Diputado Propietario,PAN,1963-08-19, Chiapas ,Mayoría Relativa, Chiapas Distrito: 11 (Huixtla) ,Maestría,Administración y contaduría,LXI,2009-08-29,2012-08-31
carlosnavarreteruiz,Carlos Navarrete Ruiz,Senador Propietario,PRD,1955-09-26, Guanajuato ,Representación Proporcional, Guanajuato ,Licenciatura,Derecho,LXI,2009-08-29,2012-08-31
carlosoznerolpachecocastro,Carlos Oznerol Pacheco Castro,Diputado Propietario,PRI,1970-10-07, Campeche ,Mayoría Relativa, Campeche Distrito: 1 (Campeche) ,Maestría,Administración y contaduría,LXI,2009-08-29,2012-08-31
carlossotelogarcia,Carlos Sotelo García,Senador Propietario,PRD,1961-10-08, México ,Representación Proporcional, Colima ,Profesor Normalista,,LXI,2009-08-29,2012-08-31
carmenguadalupefonzsaenz,Carmen Guadalupe Fonz Sáenz,Senadora Suplente,PRI,1954-06-22, Distrito Federal ,Mayoría Relativa, Campeche ,Profesor Normalista,Ciencias de la educación,LXI,2009-08-29,2012-08-31
carmenmargaritacanovillegas,Carmen Margarita Cano Villegas,Diputada Suplente,PAN,1900-01-01, ,Representación Proporcional, Chihuahua Circunscripción: Primera ,,,LXI,2009-08-29,2012-08-31
ceciliasoledadarevalososa,Cecilia Soledad Arévalo Sosa,Diputada Propietario,PAN,1968-11-22, Guanajuato ,Mayoría Relativa, Guanajuato Distrito: 7 (San Francisco del Rincón) ,Licenciatura,Derecho,LXI,2009-08-29,2012-08-31
celiagarciaayala,Celia García Ayala,Diputada Suplente,PRD,1971-01-06, Michoacán ,Mayoría Relativa, Michoacán Distrito: 9 (Uruapan del Progreso) ,Licenciatura,Psicología,LXI,2009-08-29,2012-08-31
claragomezcaro,Clara Gómez Caro,Diputada Propietario,PRI,1949-08-12, Jalisco ,Mayoría Relativa, Jalisco Distrito: 9 (Guadalajara) ,Técnico,Ciencias de la salud,LXI,2009-08-29,2012-08-31
claudiaedithanayamota,Claudia Edith Anaya Mota,Diputada Propietario,PRD,1979-06-06, Zacatecas ,Representación Proporcional, Zacatecas Circunscripción: Segunda ,Maestría,Ciencias políticas y sociales,LXI,2009-08-29,2012-08-31
claudiaruizmassieusalinas,Claudia Ruiz Massieu Salinas,Diputada Propietario,PRI,1972-07-10, Distrito Federal ,Representación Proporcional, Distrito Federal Circunscripción: Cuarta ,Doctorado,Derecho,LXI,2009-08-29,2012-08-31
claudiasofiacorichigarcia,Claudia Sofía Corichi García,Senadora Propietario,PRD,1974-05-20, Distrito Federal ,Representación Proporcional, Distrito Federal ,Licenciatura,Económico-financiera,LXI,2009-08-29,2012-08-31
coraceciliapinedoalonso,Cora Cecilia Pinedo Alonso,Diputada Propietario,Panal,1967-11-26, Nayarit ,Representación Proporcional, Nayarit Circunscripción: Primera ,Licenciatura,Ciencias de la educación,LXI,2009-08-29,2012-08-31
cristabellzamoracabrera,Cristabell Zamora Cabrera,Diputada Propietario,PRI,1979-11-16, Tamaulipas ,Mayoría Relativa, Tamaulipas Distrito: 1 (Nuevo Laredo) ,Maestría,Administración y contaduría,LXI,2009-08-29,2012-08-31
cruzlopezaguilar,Cruz López Aguilar,Diputado Propietario,PRI,1947-05-03, Nuevo León ,Representación Proporcional, Tamaulipas Circunscripción: Segunda ,Licenciatura,Agropecuaria y zootecnia,LXI,2009-08-29,2012-08-31
cuauhtemocsalgadoromero,Cuauhtémoc Salgado Romero,Diputado Propietario,PRI,1965-03-01, Guerrero ,Mayoría Relativa, Guerrero Distrito: 1 (Ciudad Altamirano) ,Licenciatura,Derecho,LXI,2009-08-29,2012-08-31
cesaraugustosantiagoramirez,César Augusto Santiago Ramírez,Diputado Propietario,PRI,1942-05-27, Chiapas ,Representación Proporcional, Chiapas Circunscripción: Tercera ,Maestría,Derecho,LXI,2009-08-29,2012-08-31
cesardanielgonzalezmadruga,César Daniel González Madruga,Diputado Propietario,PAN,1984-09-06, Distrito Federal ,Mayoría Relativa, Distrito Federal Distrito: 5 (Tlalpan) ,Licenciatura,Ciencias políticas y sociales,LXI,2009-08-29,2012-08-31
cesarfranciscobureloburelo,César Francisco Burelo  Burelo,Diputado Propietario,PRD,1958-11-07, Tabasco ,Mayoría Relativa, Tabasco Distrito: 3 (Comalcalco) ,Licenciatura,Ciencias de la salud,LXI,2009-08-29,2012-08-31
cesarmancillasamador,César Mancillas Amador,Diputado Propietario,PAN,1958-05-21, Baja California ,Mayoría Relativa, Baja California Distrito: 3 (Ensenada) ,Licenciatura,Ciencias,LXI,2009-08-29,2012-08-31
cesaroctaviomadrigaldiaz,César Octavio Madrigal Díaz,Diputado Propietario,PAN,1974-01-30, Jalisco ,Mayoría Relativa, Jalisco Distrito: 14 (Guadalajara) ,Maestría,Ciencias políticas y sociales,LXI,2009-08-29,2012-08-31
cesaroctaviopedrozagaitan,César Octavio Pedroza Gaitán,Diputado Propietario,PAN,1959-05-20, San Luis Potosí ,Mayoría Relativa, San Luis Potosí Distrito: 5 (San Luis Potosí) ,Maestría,Administración y contaduría,LXI,2009-08-29,2012-08-31
danielgabrielavilaruiz,Daniel Gabriel Ávila Ruiz,Diputado Propietario,PAN,1971-08-03, Yucatán ,Representación Proporcional, Yucatán Circunscripción: Tercera ,Licenciatura,Económico-financiera,LXI,2009-08-29,2012-08-31
danieljesusgranjapeniche,Daniel Jesús Granja Peniche,Diputado Suplente,PRI,1986-08-07, ,Mayoría Relativa, Yucatán Distrito: 4 (Mérida) ,,,LXI,2009-08-29,2012-08-31
danielanadalriquelme,Daniela Nadal Riquelme,Diputada Suplente,PRI,1987-11-14, Veracruz ,Mayoría Relativa, Veracruz Distrito: 16 (Córdoba) ,Pasante/Licenciatura trunca,Administración y contaduría,LXI,2009-08-29,2012-08-31
dantealfonsodelgadorannauro,Dante Alfonso Delgado Rannauro,Senador Propietario,MC,1950-12-23, Veracruz ,Mayoría Relativa, Veracruz ,Licenciatura,Derecho,LXI,2009-08-29,2012-08-31
davidhernandezperez,David Hernández Pérez,Diputado Propietario,PRI,1960-03-30, Jalisco ,Mayoría Relativa, Jalisco Distrito: 16 (Tlaquepaque) ,Pasante/Licenciatura trunca,Psicología,LXI,2009-08-29,2012-08-31
davidhernandezvallin,David Hernández Vallín,Diputado Propietario,PRI,1967-11-21, Aguascalientes ,Mayoría Relativa, Aguascalientes Distrito: 2 (Aguascalientes) ,Licenciatura,Ingeniería,LXI,2009-08-29,2012-08-31
dianapatriciagonzalezsoto,Diana Patricia González Soto,Diputada Suplente,PRI,1964-02-22, Coahuila ,Mayoría Relativa, Coahuila Distrito: 4 (Saltillo) ,,,LXI,2009-08-29,2012-08-31
divahadamiragastelumbajo,Diva Hadamira Gastélum Bajo,Diputada Propietario,PRI,1961-07-30, Sinaloa ,Mayoría Relativa, Sinaloa Distrito: 4 (Guasave) ,Maestría,Derecho,LXI,2009-08-29,2012-08-31
doloresdelosangelesnazaresjeronimo,Dolores de los Ángeles Názares Jerónimo,Diputada Propietario,PRD,1973-11-02, ,Representación Proporcional, Michoacán Circunscripción: Quinta ,Licenciatura,Derecho,LXI,2009-08-29,2012-08-31
doloresdelcarmengutierrezzurita,Dolores del Carmen Gutiérrez Zurita,Senadora Suplente,PRD,1963-10-07, Tabasco ,Mayoría Relativa, Tabasco ,Licenciatura,Comunicación,LXI,2009-08-29,2012-08-31
domingorodriguezmartell,Domingo Rodríguez Martell,Diputado Propietario,PRD,1965-08-01, San Luis Potosí ,Representación Proporcional, San Luis Potosí Circunscripción: Segunda ,Profesor Normalista,Ciencias de la educación,LXI,2009-08-29,2012-08-31
doraevelyntriguerasduron,Dora Evelyn Trigueras Durón,Diputada Propietario,PAN,1982-05-01, Sonora ,Representación Proporcional, Sonora Circunscripción: Primera ,Pasante/Licenciatura trunca,Derecho,LXI,2009-08-29,2012-08-31
edgardochairechavero,Edgardo Chaire Chavero,Diputado Suplente,PAN,1977-04-18, Guanajuato ,Representación Proporcional, Guanajuato Circunscripción: Segunda ,Licenciatura,Derecho,LXI,2009-08-29,2012-08-31
edgardomelhemsalinas,Edgardo Melhem Salinas,Diputado Propietario,PRI,1969-08-14, Tamaulipas ,Mayoría Relativa, Tamaulipas Distrito: 3 (Río Bravo) ,Licenciatura,Derecho,LXI,2009-08-29,2012-08-31
eduardoalonsobaileyelizondo,Eduardo Alonso Bailey Elizondo,Diputado Propietario,PRI,1961-10-14, Nuevo León ,Mayoría Relativa, Nuevo León Distrito: 3 (General Escobedo) ,Maestría,Administración y contaduría,LXI,2009-08-29,2012-08-31
eduardoledesmaromo,Eduardo Ledesma  Romo,Diputado Propietario,PVEM,1969-04-20, Baja California ,Representación Proporcional, Baja California Circunscripción: Primera ,,,LXI,2009-08-29,2012-08-31
eduardomendozaarellano,Eduardo Mendoza Arellano,Diputado Propietario,PRD,1971-08-21, Distrito Federal ,Mayoría Relativa, Distrito Federal Distrito: 18 (Iztapalapa) ,Licenciatura,Derecho,LXI,2009-08-29,2012-08-31
eduardotomasnavabolaños,Eduardo Tomás Nava Bolaños,Senador Propietario,PAN,1952-12-21, Michoacán ,Mayoría Relativa, Querétaro ,Licenciatura,Agropecuaria y zootecnia,LXI,2009-08-29,2012-08-31
eduardozarzosasanchez,Eduardo Zarzosa Sánchez,Diputado Propietario,PRI,1973-12-16, México ,Mayoría Relativa, México Distrito: 9 (Ixtlahuaca de Rayón) ,Pasante/Licenciatura trunca,Derecho,LXI,2009-08-29,2012-08-31
efrainernestoaguilargongora,Efraín Ernesto Aguilar Góngora,Diputado Suplente,PRI,1964-11-07, Yucatán ,Mayoría Relativa, Yucatán Distrito: 3 (Mérida) ,Licenciatura,Derecho,LXI,2009-08-29,2012-08-31
eloycantusegovia,Eloy Cantú Segovia,Senador Propietario,PRI,1952-09-24, Nuevo León ,Primera Minoría, Nuevo León ,Doctorado,Derecho,LXI,2009-08-29,2012-08-31
elpidiodesiderioconchaarellano,Elpidio Desiderio Concha Arellano,Diputado Propietario,PRI,1963-03-29, Chiapas ,Mayoría Relativa, Oaxaca Distrito: 2 (Teotitlán de Flores Magón) ,Licenciatura,Ciencias políticas y sociales,LXI,2009-08-29,2012-08-31
elsamariamartinezpeña,Elsa María Martínez Peña,Diputada Propietario,Panal,1958-11-06, Coahuila ,Representación Proporcional, Coahuila Circunscripción: Segunda ,Profesor Normalista,Ciencias de la educación,LXI,2009-08-29,2012-08-31
elviahernandezgarcia,Elvia Hernández García,Diputada Propietario,PRI,1962-07-14, México ,Mayoría Relativa, México Distrito: 4 (Nicolás Romero) ,Profesor Normalista,,LXI,2009-08-29,2012-08-31
emilianovelazquezesquivel,Emiliano Velázquez Esquivel,Diputado Propietario,PRD,1964-08-01, Michoacán ,Mayoría Relativa, Michoacán Distrito: 6 (Ciudad Hidalgo) ,Doctorado,Ciencias,LXI,2009-08-29,2012-08-31
emilioandresmendozakaplan,Emilio Andrés Mendoza Kaplan,Diputado Propietario,PRI,1955-12-28, Distrito Federal ,Mayoría Relativa, Oaxaca Distrito: 7 (Juchitán de Zaragoza) ,Licenciatura,Ingeniería,LXI,2009-08-29,2012-08-31
emiliochuayffetchemor,Emilio Chuayffet Chemor,Diputado Propietario,PRI,1951-10-03, Distrito Federal ,Mayoría Relativa, México Distrito: 3 (Atlacomulco de Fabela) ,Licenciatura,Derecho,LXI,2009-08-29,2012-08-31
emilioserranojimenez,Emilio Serrano Jiménez,Diputado Propietario,Ind.,1950-05-21, Distrito Federal ,Mayoría Relativa, Distrito Federal Distrito: 13 (Iztacalco) ,Pasante/Licenciatura trunca,Ciencias de la educación,LXI,2009-08-29,2012-08-31
emmalucialariosgaxiola,Emma Lucía Larios Gaxiola,Senadora Suplente,PAN,1954-06-17, Sonora ,Mayoría Relativa, Sonora ,Licenciatura,Ciencias de la salud,LXI,2009-08-29,2012-08-31
enoemargaritaurangamuñoz,Enoé Margarita Uranga Muñoz,Diputada Propietario,PRD,1963-05-01, ,Representación Proporcional, Distrito Federal Circunscripción: Cuarta ,Pasante/Licenciatura trunca,Ciencias políticas y sociales,LXI,2009-08-29,2012-08-31
enriqueoctaviotrejoazuara,Enrique Octavio Trejo Azuara,Diputado Propietario,PAN,1970-04-12, San Luis Potosí ,Representación Proporcional, San Luis Potosí Circunscripción: Segunda ,Licenciatura,Administración y contaduría,LXI,2009-08-29,2012-08-31
enriquesalomonrosasramirez,Enrique Salomón Rosas Ramírez,Diputado Suplente,PRI,1962-07-29, Tamaulipas ,Representación Proporcional, San Luis Potosí Circunscripción: Segunda ,Licenciatura,Derecho,LXI,2009-08-29,2012-08-31
enriquetorresdelgado,Enrique Torres Delgado,Diputado Propietario,PAN,1959-02-06, Sonora ,Representación Proporcional, Sonora Circunscripción: Primera ,Licenciatura,Arquitectura y diseño,LXI,2009-08-29,2012-08-31
ericluisrubiobarthell,Eric Luis Rubio Barthell,Diputado Propietario,PRI,1950-06-30, Distrito Federal ,Representación Proporcional, Yucatán Circunscripción: Tercera ,Licenciatura,Ingeniería,LXI,2009-08-29,2012-08-31
ericelgomeznucamendi,Ericel Gómez Nucamendi,Senador Suplente,MC,1900-01-01, Chiapas ,Mayoría Relativa, Oaxaca ,,,LXI,2009-08-29,2012-08-31
ernestodelucashopkins,Ernesto De Lucas Hopkins,Diputado Propietario,PRI,1976-09-05, Sonora ,Mayoría Relativa, Sonora Distrito: 3 (Hermosillo) ,Maestría,Derecho,LXI,2009-08-29,2012-08-31
ernestosaroboardman,Ernesto Saro Boardman,Senador Propietario,PAN,1950-07-25, ,Mayoría Relativa, Coahuila ,Licenciatura,Ingeniería,LXI,2009-08-29,2012-08-31
